title,authors,tags,series,series_index,comments,languages,library_name,#world,#subjects,#clasificacion,#info,#libreria,#confianza_ia,#motivo_ia,#serie_ia,#serie_ia_index
"Los Hijos De Casio","Carlos Aurensanz","Dinamica · Familia encontrada, Genero · Ficcion historica, Subgenero · Aventura/Quest, Tono · Destino/Fatalidad, Tono · Morally grey/Antiheroe, Tono · Venganza","Banū Qasī","1.0","Una novela que combina el crudo relato de la guerra, las intrigas y las rebeliones, con la descripción de la vida en Al Ándalus hace más de mil años. Destinado desde su nacimiento a dirigir a su pueblo, Musa ibn Musa toma su nombre del gran conquistador de la Península, que varias generaciones antes había alcanzado el valle del Ebro para someter al conde visigodo Casio. Sus descendientes, los Banu Qasi, ya convertidos al Islam, desempeñarán un papel más que relevante en la región durante el siglo IX de nuestra era. Junto al caudillo árabe, comparten el protagonismo de esta historia Íñigo Arista, hermano de madre de Musa, que ha de convertirse en el primer rey de Pamplona. Por otra, el emir de Córdoba, Abd al Rahman II, artífice del esplendor político y cultural de Al Ándalus en este período. En un escenario caracterizado por el enfrentamiento entre el Islam y el Cristianismo, Musa e Íñigo tratan de mantener la soberanía y la independencia de sus pueblos colocando sus lazos familiares por delante de sus diferencias de credo. Sometidos a los vaivenes de la historia, ambos se convertirán, también, en sus protagonistas.","spa","LFiccion","","","Tono · Morally grey/Antiheroe","","Ficción general","90","Primera entrega de la saga histórica sobre los Banu Qasi; narra enfrentamientos políticos y militares.","Banu Qasi","1.0"
"La guerra de Al Ándalus","Carlos Aurensanz","Dinamica · Familia encontrada, Genero · Ficcion historica, Subgenero · Aventura/Quest, Tono · Destino/Fatalidad, Tono · Morally grey/Antiheroe, Tono · Venganza","Banū Qasī","2.0","La esperada continuación de 'Banu Qasi. Los hijos de Casio'.Fascinante segunda entrega de la saga ya iniciada con 'Banu Qasi. Los hijos de Casio' que retoma la narración de los acontecimientos protagonizados por el clan muladí que da nombre a esta historia. La Frontera Superior del Ebro, donde los descendientes del gran Musa ibn Musa retoman el camino de la revuelta, cede parte de su protagonismo a la Córdoba del emirato, al naciente reino de Pamplona, al pujante rey Alfonso III en su nueva corte de León y a Bobastro, «el nido de águilas», refugio en la sierra malagueña de Umar ibn Hafsún, el rebelde muladí que acabará poniendo en jaque la propia pervivencia de Al Ándalus.Con sorprendente rigor histórico y un lenguaje claro y exento de artificios, Aurensanz escenarios, y ofrece una historia ambiciosa y compleja que de nuevo atrapará al lector.","spa","LFiccion","","","Tono · Morally grey/Antiheroe","","Ficción general","90","Novela histórica sobre conflictos en Al-Ándalus; sin romance central ni elementos fantásticos.","Banu Qasi","1.0"
"La Hora Del Califa","Carlos Auresanz","Dinamica · Familia encontrada, Genero · Ficcion historica, Subgenero · Aventura/Quest, Tono · Destino/Fatalidad, Tono · Morally grey/Antiheroe, Tono · Venganza","Banū Qasī","3.0","En los albores del siglo X, la península Ibérica se encuentra dividida entre los reinos cristianos del norte y el emirato de Córdoba en el sur, lugares donde se desarrolla esta historia. Atrapados entre ambos, el clan de los Banu Qasī, ya en horas bajas, defiende a sangre y fuego su posesión más preciada, la ciudad de Tudela. Sin embargo, los dominios que han conservado durante dos siglos se encuentran ahora en tierra de nadie, allí donde se producirá el choque inevitable entre dos civilizaciones irreconciliables. Con el rigor histórico que lo ha caracterizado desde la primera entrega de la trilogía, Aurensanz nos deleita una vez más con su enorme capacidad para convertir documentos en historia narrada y transportar al lector, mediante detalladas descripciones, a otro tiempo y otro lugar. En esta última entrega deja claro que posee un formidable talento narrativo que parece haber alcanzado su absoluta madurez.
","spa","LFiccion","","","Tono · Morally grey/Antiheroe","","Ficción general","90","Última entrega de la trilogía histórica, mantiene el mismo tono de ficción histórica sin romance central.","Banu Qasi","1.0"
"Cuentos De La Colina De Watership","Richard Adams","Dinamica · Grupo variopinto/Ragtag, Subgenero · Aventura/Quest, Subgenero · Mitologia, Tono · Profecia/Elegido","Watership Down","2.0","*Cuentos de la colina de Watership* es todo un acontecimiento: al filo de los veinticinco años de la publicación de La colina de Watership, un clásico de la narrativa moderna, su autor se enfrenta al difícil reto, evitado hasta la fecha, de hacer revivir los personajes de aquella novela, y narrarnos ignorados percances, a algunos de los cuales se aludía en La colina de Watership, y nuevas aventuras o mitos de este mundo peculiar, en los que, además, respecto a la entrega anterior, se define de modo nítido la individualidad femenina de la fauna conejil.   
Este libro es, en todos los aspectos, un digno sucesor de La colina de Watership. Convincente, conmovedor y ameno, llevará de nuevo a los lectores entusiastas a la colina de greda, hogar del hábil Avellano y sus amigos.
","eng","LFiccion","","","Subgenero · Supervivencia","","Ficción general","70","Relatos de conejos sin magia; más literario que fantástico.","Watership","1.0"
"La Colina De Watership","Richard Adams","Dinamica · Grupo variopinto/Ragtag, Subgenero · Aventura/Quest, Tono · Profecia/Elegido","Watership Down","1.0","Quinto, un joven y apacible conejo, sufre unas visiones aterradoras sobre el futuro de la conejera donde reside. Convertido en líder de sus cinco inseparables compañeros, deciden abandonar cuanto conocen para fundar un nuevo hogar. El viaje para encontrar un buen asentamiento donde empezar una nueva vida, así como las aventuras ligadas a los instintos de supervivencia de estos conejos serán el eje de esta inolvidable historia. Esta novela tiene el tono de una narración épica antigua, pero también encierra una aguda crítica de las relaciones de poder, un alegato ecológico de extraordinaria eficacia y una reflexión profunda y serena acerca de la dureza de la vida.
","eng","LFiccion","","","Subgenero · Supervivencia","","Ficción general","70","Novela de conejos realista sin elementos sobrenaturales.","Watership","1.0"
"La Conspiración De Los Vanidosos: Gladius Et Peplum","Jesús Andrades Fernández","Dinamica · Grupo variopinto/Ragtag, Genero · Romance historico, Subgenero · Aventura/Quest, Subgenero · Belica/Guerra, Subgenero · Mitologia, Tono · Morally grey/Antiheroe, Tono · Traicion","Gladius et peplum","2.0","Año 53 d. C, un navío cruza el mar Mediterráneo. Sexto Valerio, ahora Prefecto de la considerada mejor cohorte auxiliar del Imperio Romano, se dirige hacia la antigua tierra de los faraones y propiedad privada del César para llevar a cabo una misión escoltar a dos senadores.   Un tumulto en Alejandría amenaza la vida de los senadores y, por tanto, la de los hombres encargados de custodiarlos. Valerio será enviado de investigar quiénes han sido los instigadores del levantamiento, localizarlos y acabar con ellos rápidamente. Pero eso sólo será la punta del iceberg. Se verán envuelto en una elaborada conjura que podría cambiar el curso de la Historia. Combinando valentía y sagacidad, la unidad de Valerio intentará sobrellevar el trance lo mejor posible. Su camino estará plagado de dificultades, no sólo por sus pocos medios, sino también por la tensión social de Alejandría, una climatología adversa y poderosos enemigos a quienes derrotar.   Sexto Valerio recibirá peculiares favores y contará con la audacia de un benefactor. Se encontrará en complejas situaciones, paisajes diversos y gentes distintas, en este accidentado viaje desde Egipto, pasando por Creta hasta llegar a Roma, donde la traición impera en todas partes.  La conjura de los vanidosos es la segunda entrega de la saga Gladius et Peplum.","spa","LFiccion","","","Subgenero · Fantasia epica","","Fantasía","80","Misma serie, romanos con magia e intrigas.","Gladius Et Peplum","1.0"
"Gladius Et Peplum: El Baluarte Fronterizo","Jesús Andrades Fernández","Arquetipo · Heroe reticente, Dinamica · Grupo variopinto/Ragtag, Genero · Romance historico, Paranormal · Magia, Subgenero · Aventura/Quest, Subgenero · Belica/Guerra, Tono · Traicion","Gladius et peplum","1.0","Año 46 d. C, frontera occidental, bosques de la Germania Inferior. Después de cosechar una brillante victoria, al tribuno Cneo Fabio Sabino y a su principal hombre, el centurión Sexto Valerio, se les envía a una complicada misió atacar por mar a un puerto fortificado internado en territorio enemigo. Tras arduos combates e intrigas políticas, consiguen su objetivo... aunque acaban siendo traicionados y abandonados a su suerte. Tendrán que preparar la defensa, ya que los bárbaros vienen con ansias de revancha. Comenzará una breve, pero violentísima batalla, siendo mínima la esperanza de la mayoría de los soldados morirá con un extraordinario valor en combate, debido a la inmensa inferioridad numérica.A partir de ahí se desarrolla una penosa marcha hacia el Sur por la más profunda Europa, salpicada de enemigos, sorprendentes aliados, un mundo mágico y un secreto por descubrir.","spa","LFiccion","","","Subgenero · Fantasia epica","","Fantasía","80","Novela histórica con elementos mágicos y batallas.","Gladius Et Peplum","1.0"
"The Little Liar","Mitch Albom","Subgenero · Belica/Guerra, Tono · Protagonista incriminado, Tono · Redencion, Tono · Traicion, Tono · Venganza","","1.0","Beloved bestselling author Mitch Albom returns with a powerful novel that moves from a coastal Greek city during the Holocaust, to America, where the intertwined lives of three survivors are forever changed by the perils of deception and the grace of redemption. Eleven-year-old Nico Krispis never told a lie. When the Nazi’s invade his home in Salonika, Greece, the trustworthy boy is discovered by a German officer, who offers him a chance to save his family. All Nico has to do is convince his fellow Jewish residents to board trains heading to “new homes” where they are promised jobs and safety. Unaware that this is all a cruel ruse, the innocent boy goes to the station platform every day and reassures the passengers that the journey is safe. But when the final train is at the station, Nico sees his family being loaded into a large boxcar crowded with other neighbors. Only after it is too late does Nico discover that he helped send the people he loved—and all the others—to their doom at Auschwitz. Nico never tells the truth again. In The Little Liar, his first novel set during the Holocaust, Mitch Albom interweaves the stories of Nico, his brother Sebastian, and their schoolmate Fanni, who miraculously survive the death camps and spend years searching for Nico, who has become a pathological liar, and the Nazi officer who radically changed their lives. As the decades pass, Albom reveals the consequences of what they said, did, and endured. A moving parable that explores honesty, survival, revenge and devotion, The Little Liar is Mitch Albom at his very best. Narrated by the voice of Truth itself, it is a timeless story about the harm we inflict with our deceits, and the power of love to ultimately redeem us.","eng","LFiccion","","","Tono · Trauma/Salud mental","","Ficción general","80","Novela histórica sobre el Holocausto, realista, sin romance central.","",""
"The Stranger in the Lifeboat","Mitch Albom","Dinamica · Familia encontrada, Subgenero · Policiaco/Detective, Subgenero · Supervivencia, Tono · Sacrificio heroico","","1.0","**What would happen if we called on God for help and God actually appeared? In Mitch Albom’s profound new novel of hope and faith, a group of shipwrecked passengers pull a strange man from the sea. He claims to be “the Lord.” And he says he can only save them if they all believe in him.** Adrift in a raft after a deadly ship explosion, nine people struggle for survival at sea. Three days pass. Short on water, food and hope, they spot a man floating in the waves. They pull him in.  “Thank the Lord we found you,” a passenger says.  “I am the Lord,” the man whispers.  So begins Mitch Albom’s most beguiling and inspiring novel yet.  Albom has written of heaven in the celebrated number one bestsellers *The Five People You Meet in Heaven* and *The First Phone Call from Heaven*. Now, for the first time in his fiction, he ponders what we would do if, after crying out for divine help, God actually appeared before us? What might the Lord look, sound and act like?  In *The Stranger in the Lifeboat,* Albom keeps us guessing until the Is this strange and quiet man really who he claims to be? What actually happened to cause the explosion? Are the survivors already in heaven, or are they in hell?  The story is narrated by Benji, one of the passengers, who recounts the events in a notebook that is later discovered—a year later—when the empty life raft washes up on the island of Montserrat.  It falls to the island’s chief inspector, Jarty LeFleur, a man battling his own demons, to solve the mystery of what really happened.  A fast-paced, compelling novel that makes you ponder your deepest beliefs, *The Stranger in the Lifeboat* suggests that answers to our prayers may be found where we least expect them.","eng","LFiccion","","","Tono · Angst/Drama emocional","","Ficción general","70","Ficción literaria con elemento espiritual (hombre que dice ser Dios).","",""
"Un día más","Mitch Albom","Genero · Ficcion literaria, Genero · Romance contemporaneo, Genero · Romance inspiracional, Temas.Muerte Falsa, Tono · Angst/Drama emocional, Tono · Familia disfuncional, Tono · Redencion","","1.0","Tras la ruptura de su matrimonio y el fracaso en su vida profesional, Chick es un hombre roto. Lejos han quedado sus días de gloria como jugador de béisbol y su feliz matrimonio. Hundido en el alcoholismo, Chick toca fondo al recibir las fotos de la boda de su hija, a la que ni siquiera ha sido invitado. Cuando ya está decidido a suicidarse, sufre un gravísimo accidente de coche que lo coloca al borde de la muerte. Ahí, en la frontera entre la vida y el más allá, es donde se reencontrará con su madre fallecida hace ya años. Juntos pasan un día, viajarán al pasado y Chick conocerá la verdadera historia de su familia y los muchos sacrificios que su madre tuvo que hacer para sacar adelante a sus hijos. Por fin, Chick tiene la oportunidad de comprender muchas cosas de su vida.
","spa","LFiccion","","","Tono · Angst/Drama emocional","","Ficción general","70","Ficción literaria con reencuentro sobrenatural, pero no romance central.","",""
"The Rocketeer's Daughter","Clinton Aldrich","Dinamica · Desequilibrio de poder, Subgenero · Belica/Guerra, Tono · Familia disfuncional, Tono · Protagonista incriminado, Tono · Traicion","","1.0","Sixteen-year-old Marga Toth attends school, takes violin lessons, and belongs to the League of German Girls at Peenemünde on the Baltic Sea, where Nazi Germany secretly develops their infamous V2 rocket.   Marga also has a gift—one capable of disrupting the world's balance of power and one the Nazis and Allies will kill for—forcing her into a dangerous game of survival.    From Peenemünde's thundering launch pads, to Berlin's parlors, and London's war offices, The Rocketeer's Daughter captures the intrigue and danger of its time in a riveting tale where family, friendship, young love, and world domination collide.","eng","LFiccion","","","Subgenero · Belica/Guerra, Subgenero · Espionaje/Espias","","Misterio·Thriller·Terror","70","Thriller de espionaje histórico con una chica con un don (no explícitamente mágico).","",""
"Un Tal Cangrejo","Guillermo Aguirre","Genero · Ficcion historica, Genero · Ficcion realista, Tono · Angst/Drama emocional, Tono · Familia disfuncional, Tono · Maldicion/Transformacion, Tono · Morally grey/Antiheroe, Tono · Traicion","","1.0","La culpa de todo la tiene el perro, o al menos eso cree Cangrejo a sus doce años, porque es sacándolo a pasear como conoce a Jotacé y su secuaz Tarado, dos chavales libres, insolentes y violentos que personifican un universo del que Cangrejo quiere formar parte y que su familia de clase media le ha el mundo de la calle, con sus broncas y sus mitos. Inmerso en una adolescencia prematura marcada por la necesidad de liderazgo y por la creencia de que es legítimo tomar por la fuerza lo que uno ansía, muy pronto Cangrejo se ve arrastrado lejos de las aulas, expuesto a su suerte en una ciudad gobernada por muchachos y plagada de motos, trapicheos y trifulcas, sobre la que proyecta también su mitología gladiadores en anfiteatros romanos, caballeros y princesas en castillos medievales, espías y mafiosos de leyenda. Cangrejo crece así entre el mundo real y el imaginario, aprendiendo los códigos de la lealtad y el lenguaje de la traición, y en su tránsito al territorio de los adultos no tarda en comprender que estos son aún menos fiables que los propios adolescentes. Un tal Cangrejo narra, al modo de una novela picaresca, el discurrir de una adolescencia en el Bilbao de finales de los noventa, mostrando los aspectos más crudos de una masculinidad brutal que no es sino reflejo de una sociedad machista movida por la violencia, el sexo y el dinero. Una novela de aprendizaje que huye de convencionalismos, dolorosamente divertida y tensa y dura como un martillazo, en la que Guillermo Aguirre retrata con lírica desguazada y épica de ametralladora una educación sentimental en la ley de la calle. «Con los ingredientes de la novela de formación clásica y una prosa volcánica y furiosa, Guillermo Aguirre nos arrastra a través de las calles de un Bilbao mítico para narrar una historia de violencia y de el fracaso de toda una generación. Una de las mejores novelas españolas que he leído en los últimos años». Juan Gómez Bárcena.","spa","LFiccion","","","Tono · Morally grey/Antiheroe, Tono · Angst/Drama emocional, Arquetipo · Realeza","","Ficción general","90","Novela picaresca de adolescencia en Bilbao, realista.","",""
"El anatomista","Federico Andahazi","Dinamica · Desequilibrio de poder, Dinamica · Prohibido, Genero · Romance historico, Tono · Gotico, Tono · Narrador poco fiable, Tono · Picante/Erotico","","1.0","El héroe de esta novela es Mateo Colón, un anatomista del Renacimiento que al enamorarse de una prostituta veneciana, Mona Sofía, emprende la búsqueda de algún tipo de pócima que le permita conseguir su amor. El anatomista da comienzo así, nada más ni nada menos, a la ardua exploración de la misteriosa naturaleza de las mujeres. Es nuestro héroe un hombre avanzado a su tiempo, y en su audacia decide experimentar con prostitutas y, algo totalmente prohibido en la época, con la disección de cadáveres. Lo que descubre Mateo Colón en pleno siglo XVI es, tal como lo fuera América para su homónimo, una “dulce tierra hallada”: el Amor Veneris, equivalente anatómico del kleitoris, hasta entonces desconocido en Occidente. Pero al intentar hacerlo público, Colón debe hacer frente al despiadado poder de la Inquisición, lo cual le supone verse envuelto en un proceso vertiginoso. Federico Andahazi ha construido una novela apasionante y ha recreado la época renacentista no sólo en sus costumbres sino en su sistema de pensamiento. El autor le imprime un ritmo sostenido al relato así como al impecable manejo de la intriga —sin soslayar el humor y la ironía— que convierten a El anatomista, y a su autor, en una impactante revelación.","spa","LFiccion","","","Tono · Picante/Erotico, Dinamica · Amor a primera vista","","Romance histórico","80","Romance histórico renacentista con búsqueda del amor.","",""
"El Libro De Los Placeres Prohibidos","Federico Andahazi","Dinamica · Desequilibrio de poder, Genero · Misterio/Thriller, Genero · Romance historico, Tono · Gotico, Tono · Morally grey/Antiheroe, Tono · Picante/Erotico","","1.0","En el Monasterio de las Adoratrices de la Sagrada Canasta, un extravagante y lujurioso burdel a las orillas del Rhin, el habitual regocijo ha dejado lugar a un silencio compacto. Zelda, una de las más antiguas y requeridas de las místicas consagradas a la práctica de “los placeres prohibidos”, ha sido desollada viva y el terror se ha apoderado de todas sus compañeras. Será uno en una serie de cruentos y misteriosos asesinatos. ¿Cuál es la relación de Johannes Gutenberg con estos crímenes? Recluido en una lóbrega abadía en las afueras de Estrasburgo, Gutenberg experimenta con una máquina y una técnica para reproducir libros. Cuando por fin consigue imprimir los primeros ejemplares, lejos de encontrarse con la gloria, es arrestado por comerciar libros apócrifos y acusado de ser el falsificador y estafador más audaz que recuerde el Sacro Imperio Romano Germánico. Federico Andahazi ha escrito una novela de extraordinaria profundidad con los recursos de la intriga y el suspenso de los mejores thrillers. La impecable reconstrucción de los escenarios medievales transporta al lector a las diferentes ciudades europeas del siglo XV. El fabuloso avatar de la creación de un invento como la imprenta, bisagra fundamental en la historia de la humanidad, a través de un personaje complejísimo y fascinante como Gutenberg, deriva en el proceso judicial que interpela la naturaleza misma del libro. Las explícitas enseñanzas de “la gran puta”, madre superiora de la congregación, son de un erotismo poco habitual y transforman los secretos del éxtasis en un proyecto místico, sagrado, consagratorio. De manera magnífica, la resolución de los asesinatos que alteran la vida del sagrado burdel y de la ciudad termina uniendo todas las historias y conduce hacia el libro buscado por todos: el Libro de los placeres prohibidos.","spa","LFiccion","","","Subgenero · Policiaco/Detective, Ambientacion · Victoriano","","Misterio·Thriller·Terror","90","Thriller histórico sobre asesinatos y Gutenberg.","",""
"Los Amantes Bajo El Danubio","Federico Andahazi","Dinamica · Prohibido, Dinamica · Proximidad forzada, Dinamica · Triangulo amoroso, Genero · Ficcion realista, Genero · Romance historico, Subgenero · Belica/Guerra, Tono · Angst/Drama emocional, Tono · Morally grey/Antiheroe, Tono · Picante/Erotico","","1.0","Budapest, 1944. Hanna y Bora se reencuentran muchos años después de su doloroso divorcio. Jamás imaginaron que volverían a convivir en circunstancias tan extremas. Los nazis han ocupado la ciudad y cazan judíos. Bora, un aristocrático pintor y diplomático, refugia en el sótano de su casa a su ex mujer y a su actual marido, los dos judíos. Andris es el hombre con quien Hanna lo engañó. La trama se desarrolla en dos planos: el del subsuelo y el de la casa, donde Bora vive con Marga, su segunda esposa. Ambos mundos entrarán en un conflicto silencioso que modificará dramáticamente la vida de los personajes. Mientras Bora recibe la visita diaria de un oficial nazi que quiere ser retratado por el eximio artista, los cautivos encontrarán la salvación en el placer. El sexo será el vínculo más puro con la vida frente al acecho de la muerte.Los amantes bajo el Danubio es una apasionante y conmovedora historia de amor que atraviesa el tiempo de la guerra y el de la paz. Una magnífica novela que atrapa de principio a fin con una trama profunda, sutil y sorprendente.","spa","LFiccion","","","Tono · Angst/Drama emocional, Subgenero · Belica/Guerra","","Romance histórico","90","Romance histórico en Budapest durante la guerra.","",""
"Errante en La Sombra","Federico Andahazi","Genero · Romance historico, Tono · Angst/Drama emocional, Tono · Morally grey/Antiheroe, Tono · Narrador poco fiable","","1.0","**Una novela policial en clave la voz de Carlos Gardel, otra a su sombra y un asesinato al compás del dos por cuatro.** Juan Molina nació para cantar tango. Su voz, para algunos superior a la de Carlos Gardel, lo acerca a la gloria y también lo condena. Leal al Zorzal criollo, rehúsa disputar su lugar y elige callar, quedarse a la sombra del gran cantor, aunque esa renuncia lo arrastre a un destino oscuro. La fidelidad que lo define se convertirá en la marca de su tragedia.  Su historia puede contarse en un día y una noche, o en el nombre de una Ivonne. Obligada por una sórdida organización a vender un amor ficticio en un hotel lujoso, irrumpe en la vida de Molina y precipita lo inevitable. Entre ella, Gardel y Molina se forma un triángulo de deseo, devoción y traición. Y tras la revelación de una verdad insoportable, el asesinato se vuelve el único desenlace posible, marcando cada paso y sellando el rumbo de los personajes como una sentencia inapelable.  ***Errante en la sombra* ** avanza con la tensión de un policial y la cadencia de una canción sombría. **Federico Andahazi** construye un melodrama donde escenas que parecen salidas de una comedia musical dejan entrever, bajo la niebla de Buenos Aires, la violencia y la fatalidad que acechan. Una novela de amor y crimen, de mito y obsesión, que se despliega entre la leyenda y la calle, y que respira en compás de dos por cuatro, como una melodía escrita con sangre.","spa","LFiccion","","","Subgenero · Policiaco/Detective, Tono · Angst/Drama emocional","","Misterio·Thriller·Terror","90","Thriller histórico sobre tango y asesinato.","",""
