title,authors,tags,series,series_index,comments,languages,library_name,#world,#subjects,#clasificacion,#info,#libreria,#confianza_ia,#motivo_ia,#serie_ia,#serie_ia_index
"La Historia Del Silencio","Pedro Zarraluki","Dinamica · Prohibido, Genero · Ficcion historica, Genero · Ficcion literaria, Tono · Familia disfuncional","","1.0","Esta novela trata de otro libro que no llegó a ser escrito, y también de todo aquello que ocultamos a las personas que más seguras están de conocernos. Tras una bella ensoñación compartida, una pareja decide embarcarse en la preparación de un libro sobre el silencio. Emprenden el trabajo con desordenada pasión y no tardan en descubrir que el silencio aparece por todas partes -en el insomnio de Scott Fitzgerald, en la tribu de los mabaanes, en los escritos de Auden y en los experimentos de un tal sir Robert Boyle-, aunque revestido siempre por su impenetrable calidad de ausencia. Con el tiempo, llegarán a sospechar que cada persona se relaciona con sus propios silencios de una forma parecida a como lo hace con sus propias manos. Y los silencios en verdad importantes, los que deberían figurar en su libro imposible, son los pequeños secretos que nos permiten sobrevivir, las mínimas traiciones con que se alimenta el amor, los sentimientos inconfesables.  En sus relaciones con los demás, y en especial durante su turbia historia con la voluble y atractiva mujer de su mejor amigo, el protagonista se convertirá en el más cumplido ejemplo de tales ocultaciones. No sin gran asombro, se sorprenderá a sí mismo en el acto de silenciar sus torpes deseos, como único camino para mantener el engañoso equilibrio en que cree sostenerse. Al final, llegará a intuir que el engaño es una necesidad universal, y que sólo podemos defendernos de sus estragos con una acorazada resignación.  En esta espléndida novela, en la que Pedro Zarraluki despliega su más implacable sentido del humor, se muestra hasta qué punto la vida es una comedia amenazada siempre por un final trágico. La risa, que utilizamos para espantar el silencio, reúne la doble condición de ser la manera más excéntrica, pero también más elegante, de olvidar por un instante la cercanía de ese peligro.","spa","LFiccion","","","","","Ficción general","90","Novela literaria sobre el silencio, los secretos y las relaciones.","",""
"Un Encargo Difícil","Pedro Zarraluki","Genero · Ficcion literaria, Genero · Romance historico, Tono · Familia disfuncional, Tono · Traicion","","1.0","Verano de 1940. Leonor, esposa de un republicano de alto rango fusilado al final de la guerra, y su hija Camila se ven obligadas a exilarse a la isla de Cabrera. Conviven allí con un matrimonio que tiene una miserable cantina y también con unos cuantos pescadores, un eremita alemán y un destacamento militar aterrado por la amenaza de un ataque del ejército británico. Entretanto, en Mallorca, las autoridades confían a un hombre un encargo que lo redimirá de su oscuro pasado. Pedro Zarraluki idea una apasionante historia que convierte a esta isla mediterránea en un mundo único donde sólo existirá la armonía a través de las relaciones humanas y de sus normas. Una lúcida indagación narrativa que gira en torno a la amistad y al voto de silencio, al desaliento y al optimismo. En Un encargo difícil, dos mujeres nos demuestran que, incluso en las peores circunstancias, siempre es posible comenzar de nuevo. Porque lo que hace la felicidad depende más de la integridad de ciertas personas que de las leyes que nos gobiernan. Magnífica novela de supervivientes y, al propio tiempo, oda a la inagotable energía que permite que nos recuperemos de los descalabros que nos depara el destino.","spa","LFiccion","","","","","Ficción general","85","Novela histórica sobre supervivientes en la posguerra española, sin romance central.","",""
"Todo Eso Que Tanto Nos Gusta","Pedro Zarraluki","Dinamica · Familia encontrada, Genero · Ficcion historica, Tono · Familia disfuncional","","1.0","No siempre es fácil ser padre. Tampoco es fácil ser hijo. En realidad, nada es fácil en esta vida… y ahí está la clave de la comedia. La dificultad acaba convirtiéndose en el corazón mismo del placer de vivir. Un anciano se escapa en busca de un palacio inalcanzable, y su hijo va tras él. En su huida se encontrarán con una chica que está segura de amar, pero no de comprometerse a amar para siempre; con una mujer perturbadora que vive sola con su mayordomo y su cocinera napolitanos; con una ciega que nunca quiso trabajar y acabó cultivando las rosas más bellas…  Padre e hijo comprenderán que vivir puede ser apasionante si se sabe mirar a los demás, hacerse cómplice de ellos. Si se sabe no tener miedo al ridículo, al miedo mismo. Y que es, al fin y al cabo, la única oportunidad que tenemos de dar un pequeño paseo por el paraíso. Todo eso que tanto nos gusta es una novela radiante, escrita en estado de gracia. Una novela que aborda los grandes temas de la existencia con sabia naturalidad, con una sencillez elegantísima, y que sugiere que quizás el único secreto para vivir consista en conseguir llegar a ser quienes ya somos... y en bailar hasta el amanecer.","spa","LFiccion","","","","","Ficción general","90","Novela humorística sobre la relación padre-hijo y la vida.","",""
"Te Espero Dentro","Pedro Zarraluki","Genero · Ficcion historica, Tono · Familia disfuncional, Tono · Narrador poco fiable","","1.0","Los personajes de estas historias no saben que se les observa. Una niña enseña a su padrea hacerse el dormido para escapar de las situaciones sin salida; una anciana que ve por primera vez la televisión descubre con El Padrino la relación entre el tiempo y los saltamontes; la conversación entre dos hermanos se convierte en una rebelión contra la vida que les dio su padre; Sonia engulle botes de leche condensada como alivio ante un presente que la desborda... Y es entonces cuando llega el instante en que algo de vital importancia va a cambiar para ellos, sin que aún sean conscientes de lo que sucede. Cualquiera de nosotros, de haber sido observado en un momento de frágil intensidad,podría habitar este libro.Con su característico humor y su finísima elegancia, y también con una inagotable ternura, Pedro Zarraluki revela la inesperada capacidad de unas vidas que parecen haber tocado fondo para resurgir con imaginación y recuperar su dignidad.","eng","LFiccion","","","","","Ficción general","90","Cuentos sobre momentos de cambio en la vida cotidiana, tono literario.","",""
"Bonsái","Alejandro Zambra","Genero · Ficcion literaria, Genero · Romance contemporaneo, Tono · Amor toxico, Tono · Maldicion/Transformacion, Tono · Narrador poco fiable","","1.0","Condenado a la seriedad y a la impostura, Julio, el silencioso protagonista de este libro, acaba convenciéndose de que es mejor encerrarse en su cuarto a observar el crecimiento de un bonsái que vagar por los incómodos caminos de la literatura. Es ésta, como dice el narrador, «una historia liviana que se pone pesada», un relato elíptico y vertiginoso marcado por la inquietante desaparición de una mujer. 
Jorge Luis Borges aconsejaba escribir como si se estuviera redactando el resumen de una obra ya escrita. Eso es lo que ha hecho Alejandro Zambra en este libro que, del mismo modo que un bonsái no es un árbol, más que una novela corta o un relato largo es una novela-resumen o, justamente, una novela-bonsái. **Bonsái** supone el brillante debut narrativo del joven chileno Alejandro Zambra, poeta y crítico literario.
","spa","LFiccion","","","","","Ficción general","90","Novela literaria minimalista.","",""
"La Vida Privada De Los Árboles","Alejandro Zambra","Arquetipo · Universitario/New adult, Genero · Ficcion literaria, Tono · Familia disfuncional, Tono · Maldicion/Transformacion, Tono · Narrador poco fiable","","1.0","Verónica tarda, Verónica se demora inexplicablemente y el libro sigue hasta que ella regrese o hasta que Julián esté seguro de que ya no volverá. Hacia el final, Julián quiere escribir y no ser escrito, pero esperar es dejarse escribir: esperar es seguir una constante deriva de imágenes. Entonces la historia comienza mucho antes de esa noche última, tal vez una tarde de 1984, con la escena de un niño mirando televisión. Y termina con las inevitables conjeturas sobre la vida de Daniela, la hija de Verónica, a los veinte, a los veinticinco, a los treinta años, cuando ha pasado mucho tiempo desde que su padrastro le contaba historias sobre los árboles.  ¿Por qué leer y escribir libros en un mundo a punto de quebrarse? Esta pregunta ronda cada página de La vida privada de los árboles, una novela que confirma a Alejandro Zambra como uno de los escritores más interesantes de las nuevas generaciones.","spa","LFiccion","","","Arquetipo · Universitario/New adult","","Ficción general","90","Novela literaria introspectiva.","",""
"Formas de volver a casa","Alejandro Zambra","Genero · Ficcion historica, Genero · Ficcion literaria, Genero · Romance contemporaneo, Tono · Familia disfuncional, Tono · Narrador poco fiable, Tono · Traicion","","1.0","Formas de volver a casa habla de la generación de quienes, como dice el narrador, aprendían a leer o a dibujar mientras sus padres se convertían en cómplices o víctimas de la dictadura de Augusto Pinochet. La esperada tercera novela de Alejandro Zambra muestra el Chile de mediados de los años ochenta a partir de la vida de un niño de nueve años. El autor apunta a la necesidad de una literatura de los hijos, de una mirada que haga frente a las versiones oficiales. Pero no se trata sólo de matar al padre sino también de entender realmente lo que sucedía en esos años. Por eso la novela desnuda su propia construcción, a través de un diario en que el escritor registra sus dudas, sus propósitos y también cómo influye, en su trabajo, la inquietante presencia de una mujer. Con precisión y melancolía, Zambra reflexiona sobre el pasado y el presente de Chile. Formas de volver a casa es la novela más personal de uno de los mejores narradores de las nuevas generaciones. Un libro que ratifica lo que Ricardo Piglia ha dicho sobre Alejandro Zambra: «Un escritor notable, muy perceptivo frente a la diversidad de las formas»
","spa","LFiccion","","","Tono · Trauma/Salud mental","","Ficción general","90","Novela literaria sobre la dictadura chilena.","",""
"Mis documentos","Alejandro Zambra","Formato · Antologia/Relatos, Genero · Ficcion literaria, Tono · Familia disfuncional, Tono · Maldicion/Transformacion, Tono · Narrador poco fiable","","1.0","Antología de 11 cuentos que rememoran los años ochenta y noventa a través de historias de niños y adultos, que fueron redactados durante los últimos cinco años. 
""Son relatos sobre la memoria, relatos sobre el cómo se experimenta la distancia entre lo público y lo privado, por eso el título también, porque 'Mis documentos' suena como a algo muy personal, pero esa carpeta está en los computadores de todo el mundo. Todos tenemos ese carpeta y esa ilusión de vida propia, pero es más bien cómo esta vida privada nunca es totalmente privada, siempre está dispuesta a la historia"", adelanta el autor de ""Bonsai"".
","spa","LFiccion","","","","","Ficción general","90","Relatos literarios.","",""
"Fresh Mint With Lemon","Monika Zgustová","Dinamica · Amor a primera vista, Dinamica · Ricos y pobres, Dinamica · Triangulo amoroso, Genero · Ficcion literaria","","1.0","During a sultry month on the Mediterranean coast, tension mounts in a triangle of love, power, and desire between a Russian art critic, an American artist, and a provocative activist  Russian art critic Vadim meets a mysterious North American artist of Russian origins, Patricia Pavloff, in Saint Petersburg. Captivated by the painter’s brilliance, the young critic travels to the coastal Catalonian town of Sitges, where Patricia lives, hoping to interview her and write a book about her work. Vadim’s dreams of being admitted to the inner sanctuary of the artist’s studio wax and wane as Patricia’s personality oscillates between two extremes. She’s friendly and playful one moment, cold and distant the next. Patricia shares her house with the voluptuous and provocative Radhika, whose power games foster an unsettling dynamic between the three. Attracted by Radhika’s beauty but repelled by her politics, Vadim doesn’t know which of the two women he desires most.  Underlying the sexual and romantic tension are the dramatic events of the Prague Spring of 1968, cut short by the Soviet invasion. The juxtaposition of two narratives provokes fresh perspectives in this multi-layered and sensual exploration of the nature of love, art, guilt, and freedom.","eng","LFiccion","","","Dinamica · Triangulo amoroso, Tono · Angst/Drama emocional","","Ficción general","80","Novela literaria con triángulo amoroso y contexto histórico (Praga 1968), sin elementos de género claros.","",""
"La Noche De Valia","Monika Zgustová","Dinamica · Segunda oportunidad, Genero · Ficcion historica, Subgenero · Supervivencia, Tono · Familia disfuncional","","1.0","http://www.monikazgustova.com/  Tras largos años en el gulag, tratando de encontrar fuerzas en la solidaridad entre las presas, en la amistad, en el arte, en el trabajo, en la esperanza, cuando queda poco, poquísimo en lo que sustentarse.  Valia retoma su vida, a su hija a la que tuvo que abandonar con dos años y reemprende la búsqueda de un amor truncado con un hombre que nunca entendió por qué Valia dejó de contestar a sus cartas. Valia había sido acusada injustamente de espionaje debido a su relación con Bill Rowgrave, un marine norteamericano. Con el fin de la guerra, la esperanza del reencuentro con Bill se ve trágicamente truncada por la acusación y arresto que la llevará a vivir el horror del confinamiento en el gulag.  Tras un accidentado viaje en metro y ferrocarril, Zgustova localizó en el pueblo Shcherbinka a Valentina Grigórievna Íeleva: “Prácticamente impedida por la malnutrición y el frío intenso de los años de prisión, ni el dolor físico ni al edad conseguían apagar la enorme seducción y fuerza de su relato” recuerda. Después de preparar un te, Valentina le mostró fotos del amor de su vida, un soldado americano llamado Bill con el que tuvo una hija. “Llámeme Valia y escriba sobre mi vida, reina. Y sobre mi amor. Nos vimos poco y sin embargo pasamos medio siglo locamente enamorados…”.  En ese medio siglo de penalidades transcurre “La noche de Valia”, testimonio novelado de esa mujer que en 1945 fue detenida por la NKVD y deportada al gulag acusada espionaje a favor de los americanos. Una noche, aclara Zgustova, “que concentra las vivencias de Valia y de las otras expresas con las que hablé”.  Destinada a Salejard, ciudad del norte donde iban a parar los convictos en la época zarista y que Dostoievski describió en “Recuerdos de la casa de los muertos”, Valia constató que los campos estalinistas eran infinitamente peores que los del Zar: “Se sabe mucho de los lagers nazis"", corrobora Zgustova, “pero no se quiere recordar el gulag”  Dramática y esperanzadora a la vez, una novela que es un testimonio emocionante acerca de la supervivencia del amor y la lucha por la vida.  ///////////// JRC BALCÁCER","spa","LFiccion","","","Dinamica · Segunda oportunidad, Tono · Angst/Drama emocional, Subgenero · Belica/Guerra","","Romance histórico","70","Historia de amor truncada por el gulag, búsqueda de reencuentro en contexto histórico de posguerra.","",""
"La Mujer Silenciosa","Monika Zgustová","Dinamica · Prohibido, Genero · Ficcion historica, Temas.Exilio, Tono · Familia disfuncional","","1.0","Bajo la dramática coyuntura de la Praga sometida a la invasión nazi y a la barbarie soviética, Sylva, una mujer enigmática y reservada de origen aristocrático, comprueba en su vejez que pocas cosas en la vida dependen de nuestros deseos. Una boda sin amor, la pérdida de sus seres queridos y el exilio forzoso de su único hijo jalonan un sufrimiento que sólo el hecho de vivir en el recuerdo y la esperanza del reencuentro con su antiguo amor pueden mitigar. En este libro, Monika Zgustova se confirma como una de las voces más singulares de la narrativa europea contemporánea","spa","LFiccion","","","Dinamica · Segunda oportunidad, Tono · Angst/Drama emocional, Ambientacion · Victoriano","","Romance histórico","70","Romance central ambientado en la Praga ocupada, con reencuentro amoroso como motor de la trama.","",""
"Yo fui Johnny Thunders","Carlos Zanón","Dinamica · Pez fuera del agua, Genero · Ficcion historica, Genero · Misterio/Thriller, Tono · Familia disfuncional, Tono · Morally grey/Antiheroe, Tono · Redencion","","1.0","Francis, Mr. Frankie, decide regresar al lugar donde vivió las primeras cosas, a su barrio. Se marchó de allí persiguiendo su particular sueño de rock 'n' roll, que le llevó a acariciar con la punta de sus dedos una fama tóxica y efímera. Ahora Francis vuelve para dejar atrás la miseria y la drogadicción. Pero su viejo barrio son ruinas por donde aún deambulan su padre, su medio hermana, su primera novia y algún que otro amigo. Francis quiere empezar de nuevo y hacer las cosas bien. El problema son los atajos, las canciones de tres minutos, la imposibilidad de olvidar quién fue. Para Francis la línea recta es la distancia más retorcida entre dos puntos. De momento, sus facturas y sus noches no suele pagarlas él, pero esa situación no puede alargarse mucho más. Va a necesitar algo más que promesas para salir adelante. Eso sí, en una ocasión fue Johnny Thunders.
","spa","LFiccion","","","Arquetipo · Rockstar/Celebridad, Tono · Trauma/Salud mental","","Ficción general","80","Novela literaria sobre un rockero en decadencia.","",""
"El escalón 33","Luis Zueco","Genero · Misterio/Thriller, Subgenero · Aventura/Quest, Subgenero · Policiaco/Detective, Tono · Protagonista incriminado","","1.0","Silvia, gran apasionada de los libros, trabaja como restauradora en la Biblioteca Nacional de Madrid, pero está cansada de su rutinaria vida y desea que todo cambie. Una noche descubre unos enigmáticos textos acompañados de unos extraños símbolos cuyo significado desconoce. ¿Qué ocultan esos símbolos? ¿A dónde lleva la resolución de esos enigmas? Demasiadas preguntas que irá respondiendo con la ayuda de Álex, un investigador especialista en arte medieval y experto en castillos.  
  
  
  
Oscuros y peligrosos personajes vigilan todos sus pasos, un profesional del robo de obras dearte, una misteriosa mujer, un magnate dispuesto a cualquier cosa para descifrar el secreto... Nada es lo que parece y un misterio medieval está en juego.  
  
  
  
<EM style=""FONT-STYLE: italic; COLOR: #000000"">El escalón 33 es un viaje por la historia medieval y los castillos de España, ambientado en una atmósfera inquietante y enigmática. Un <EM style=""FONT-STYLE: italic; COLOR: #000000"">thriller original, alejado de arquetipos, que innova el género y propone una aventura tan misteriosa como fascinante.
","spa","LFiccion","","","Subgenero · Policiaco/Detective","","Misterio·Thriller·Terror","90","Thriller con enigmas medievales y restauración de libros, sin romance ni elementos fantásticos.","",""
"Tierra Sin Rey","Luis Zueco","Ambientacion · Medieval, Arquetipo · Heroe reticente, Dinamica · Grupo variopinto/Ragtag, Dinamica · Mentor/Aprendiz, Genero · Ficcion historica, Tono · Venganza","","1.0","Hace 800 años, en una tierra azotada por la herejía cátara, el rey Pedro II de Aragón y conde de Barcelona, encabezaba un poderoso ejército que luchaba de manera encarnizada en una batalla campal contra la primera cruzada convocada en suelo cristiano.  
Hace 800 años, en una tierra azotada por la herejía cátara, el rey Pedro II de Aragón y conde de Barcelona, encabezaba un poderoso ejército que luchaba de manera encarnizada en una batalla campal contra la primera cruzada convocada en suelo cristiano. Un monarca cruzado, apodado el Católico, coronado por el papa Inocencio III en Roma y victorioso en la batalla de Las Navas de Tolosa contra los infieles, se revelaba contra la Iglesia. ¿Qué había podido provocar tal incoherente situación? Un sueño, un anhelo que hubiera cambiado para siempre la historia. Un reino a ambos lados de los Pirineos, una Gran Corona de Aragón.
","spa","LFiccion","","","","","Ficción general","90","Ficción histórica sobre la cruzada albigense, sin romance ni elementos fantásticos.","",""
"Rojo Amanecer en Lepanto","Luis Zueco","Dinamica · Grupo variopinto/Ragtag, Genero · Ficcion historica, Subgenero · Aventura/Quest, Subgenero · Belica/Guerra, Subgenero · Espionaje/Espias","","1.0","Año 1560, mi nombre es Alejandro Famesio, príncipe de Parma, he sido enviado a estudiar a la universidad de Alcalá de Henares junto al heredero a la corona de España, el príncipe Carlos, y don Juan de Austria. Siento curiosidad por este joven que acaba de ser reconocido por el rey Felipe como su hermano, algo me dice que está marcado por el destino. Al igual que yo mismo, no en vano mi madre también es hija del emperador Carlos V y el abuelo de mi padre era el papa Paulo IIl, por mis venas corre sangre real y pontificia. Comentan en la corte que no existe parangón en la historia para este extraordinario hecho. No es una buena época para España, demasiados enemigos: los moros rebeldes en Granada, los herejes en Flandes e Inglaterra y, sobre todo, los turcos en el Mediterráneo. Pero yo estoy deseando partir a luchar junto a los tercios y morir, si es necesario, por defender este Imperio donde nunca se pone el sol","spa","LFiccion","","","Arquetipo · Realeza, Subgenero · Espionaje/Espias","","Ficción general","90","Ficción histórica sobre el siglo XVI español, centrada en batallas y política, sin romance.","",""
"A Night at the Cinema","Andrew Zellgert","Ambientacion · Portal a otro mundo/Isekai, Dinamica · Grupo variopinto/Ragtag, Subgenero · Aventura/Quest, Subgenero · Cozy mystery, Tono · Protagonista incriminado","","1.0","Alex lost something important....  Stephanie is looking for her destiny...  Victoria needs to stop a madman...  A Night at the Cinema is the most epic collection of cinema-like stories ever compiled in one place.  Thriller...  Alex is trapped in the Dissimulate Institute. There are bullies, dangers, and mysteries at every turn. A chilling disturbance operates unseen in the shadows. Biding its time.  Fantasy...  Stephanie boards a magical steam train hoping to ride to her destiny. When she learns her ex is in trouble, she has to face many dangers to save him and everyone else.  Sci-Fi...  Victoria had a perfectly ordinary life until one day, she is kidnapped and brought to a higher plane of existence. Beyond comprehension. Beyond cardinality.  Stories truly worthy of the cinema.  Get the collection today!","eng","LFiccion","","","Tono · Cozy/Ligero, Subgenero · Cozy mystery","","Ficción general","60","Antología de relatos de thriller, fantasía y ciencia ficción; al ser mixta se clasifica como ficción general.","",""
"Generaciones","Cristóbal Zaragoza","Genero · Ficcion historica, Tono · Destino/Fatalidad, Tono · Familia disfuncional, Tono · Maldicion/Transformacion","","1.0","Generaciones es la novela del último medio siglo de la vida española. Protagonista de es extenso relato es nuestra sociedad. Con sus ideas y su evolución. Con la lucha ideológica que vienen sosteniendo las generaciones que se suceden a lo largo de estos cincuenta años. Lucha que, en ocasiones, como en nuestra guerra civil, manchó de sangre manos y conciencias y perpetuó durante años el rencor, cuando no el odio, en el seno de las familias. Formando dos planos que convergen al final de relato, Generaciones es por otra parte un trasunto fiel de español al tránsito a la democracia. Desde las jubilosas manifestaciones que llenaron nuestras calles en los primeros días hasta el desencanto de los últimos tiempos, pasando por los momentos cruciales, como el enigma de la “Operación Galaxia” y el referéndum constitucional. Todo ello urdido en el complejo cañamazo de una intrigante trama novelesca que tiene como fondo toda la carga de pasiones, de ilusiones, dudas y fracasos que conlleva el vivir. Novela realista de corte clásico, Generaciones contiene los mejores ingredientes del género: la calidad human busca de los personajes, la reflexión precisa, el dominio de la técnica descriptiva y del diálogo. Pero Generaciones es algo más que todo esto. Porque en esta elaborada novela el autor recrea minuciosamente la realidad, sin suplantarla, al mismo tiempo que profundiza en al conciencia de los personajes en busca de los demonios familiares. Los que tantas veces nos han llevado al desastre, precisamente cuando más despejado se veía el horizonte de nuestra convivencia.
","spa","LFiccion","","","Subgenero · Belica/Guerra","","Ficción general","80","Novela histórica sobre la sociedad española del siglo XX.","",""
