title,authors,tags,series,series_index,comments,languages,library_name,#language_code,#world,#subjects,#info,#libreria,#confianza_ia,#motivo_ia,#serie_ia,#serie_ia_index
"Shakespeare's Champion","Charlaine Harris","Genero · Misterio/Thriller, Subgenero · Policiaco/Detective, Tono · Oscuro","Lily Bard","2.0","When Lily stumbles upon the well-built corpse of a local body builder-his neck broken by a barbell-the town's underlying racial tension begins to boil over. The white victim was somehow connected to two unsolved murders of black residents of Shakespeare-and a dogged policeman is determined to stop the killing. But it is Lily herself who may have to decide whether to stay and fight for justice, or run away one more time. 
There's something rotten in Shakespeare... — Lily Bard was running from shattering memories when she moved to Shakespeare, Arkansas. Now cleaning houses pays her bills. Working out helps her heal. Still protecting her scars, she hides a hard body and impressive skill at martial arts under baggy sweats. And nobody knows how strong she is until racial violence has her looking behind closed doors for a killer -- doors to which a housecleaner might have the key. 
When Lily uses her training in goju to help a black man jumped by white teens, she does it for justice...only to hear he's been abducted and beaten to death a few weeks later. Then a bodybuilder is killed at her gym. Both incidents jar Lily's need for security and refuge. Looking into closets, sweeping under rugs, she soon uncovers enough dirt to confirm that something sinister is growing in her adopted town. Getting involved could endanger her life. But Lily is seeing a new man and dreaming new dreams. And no one can make this strong woman run again.
There's something rotten in Shakespeare... — Lily Bard was running from shattering memories when she moved to Shakespeare, Arkansas. Now cleaning houses pays her bills. Working out helps her heal. Still protecting her scars, she hides a hard body and impressive skill at martial arts under baggy sweats. And nobody knows how strong she is until racial violence has her looking behind closed doors for a killer -- doors to which a housecleaner might have the key. 
When Lily uses her training in goju to help a black man jumped by white teens, she does it for justice...only to hear he's been abducted and beaten to death a few weeks later. Then a bodybuilder is killed at her gym. Both incidents jar Lily's need for security and refuge. Looking into closets, sweeping under rugs, she soon uncovers enough dirt to confirm that something sinister is growing in her adopted town. Getting involved could endanger her life. But Lily is seeing a new man and dreaming new dreams. And no one can make this strong woman run again.
","eng","LMisterioThriller","eng","","","","Misterio·Thriller·Terror","100","Misterio con protagonista traumatizada y artes marciales.","Lily Bard","1.0"
"Shakespeare's Christmas","Charlaine Harris","Genero · Misterio/Thriller, Subgenero · Policiaco/Detective, Tono · Oscuro","Lily Bard","3.0","**Charlaine Harris's beloved series returns just in time for Christmas with this paperback re-issue.**  
Charlaine Harris's unique spin on the traditional cozy has garnered high praise and dedicated fans for her first two books set in Shakespeare, Arkansas. Harris has added a touch of noir to this typical charming Southern town and given a dark past to her heroine, cleaning woman and karate expert Lily Bard. The series debut, Shakespeare's Landlord, was named one of the top ten mysteries of 1996 by Mostly Murder, and Seventeen said of Shakespeare's Champion, ""We love the heroine of this compelling mystery. . . . Lily is too cool.""   
In Shakespeare's Christmas, Lily goes home-always an uncomfortable scenario for the introverted Lily-for her sister's Christmas wedding. A four-year-old unsolved kidnapping resurfaces to push Lily to act once again as amateur sleuth to protect her sister-whose new husband is the widowed father of a girl bearing a remarkable resemblance to the vanished child.  
### About the Author  
CHARLAINE HARRIS is a *New York Times* bestselling author who has been writing for over thirty years. She was born and raised in the Mississippi River Delta area. She is the author of the Aurora Teagarden mysteries, the Shakespeare mysteries, the Harper Connelly mysteries, the Cemetery Girl mysteries, and the Sookie Stackhouse urban fantasy series, which is the basis for the HBO show *True Blood*. Harris now lives in Texas with her husband.
","eng","LMisterioThriller","eng","","","","Misterio·Thriller·Terror","100","Misterio navideño con secuestro.","Lily Bard","1.0"
"Shakespeare's Trollop","Charlaine Harris","Genero · Misterio/Thriller, Subgenero · Policiaco/Detective, Tono · Oscuro","Lily Bard","4.0","Welcome back to Shakespeare - a charming Arkansas town with endless back roads, an eclectic mix of residents, and a dollop of noir. Featuring cleaning woman/karate expert Lily Bard, Charlaine Harris's series puts a unique spin on the traditional cozy to create mysteries that ""work on every level. The writing and plotting are first rate [and] Lily is appealing in her own prickly way"" -- Washington Time s   
In this installment, Lily discovers lifelong Shakespeare resident Deedra Dean murdered inside a car parked in a woodsy area outside town. Determined not to get involved, Lily wants to leave the police work to Sheriff Marta Schuster and her team of deputies, and concentrate on cleaning, high kicks, and her boyfriend Jack's impending visit. But when Deedra's notoriously promiscuous lifestyle provides an extensive list of suspects but very few clues, Lily has no choice but to resume the roll of amateur detective and join the investigation.   
In Shakespeare's Trollop , the fourth book in Charlaine Harris's highly acclaimed and darkly compelling series, Lily Bard delivers a hard-hitting mix of Southern charm and street smarts, a combination so alluring that long-time readers and newcomers will be dying to visit Shakespeare again.
","eng","LMisterioThriller","eng","","","","Misterio·Thriller·Terror","100","Misterio con asesinato de una mujer promiscua.","Lily Bard","1.0"
"Shakespeare's Counselor","Charlaine Harris","Genero · Misterio/Thriller, Subgenero · Policiaco/Detective, Tono · Oscuro","Lily Bard","5.0","**Welcome back to the sleepy little town of** **Shakespeare** **,** **Arkansas** **, where secrets come to hide.**
Cleaning woman and karate expert Lily Bard is a woman with a complicated past. Trying her best to cope with her terrifying memories and horrible nightmares, she decides to join a weekly group therapy session in her hometown of Shakespeare, Arkansas. At first, Lily can hardly believe the number of her fellow Shakespeareans that share her life experiences. 
As it turns out, the group members' feelings aren't the only things that need sorting out -- they assemble for a session and find a woman dead, killed in bone-chilling fashion and deliberately left on display to send a twisted message. Who would commit such horrendous crime, and who is the intended recipient of the message? 
Before long, Lily becomes embroiled in this disturbing murder and its aftermath, one in which the brutal killer's motives are entirely unclear. The truth is, the situation has dredged up more than a few of her own terrible secrets, and she may not be able to rest until she can untangle the who and why of this terrible crime. But can she accomplish this before the killer strikes again, and before her nightmares send her over the edge? 
","eng","LMisterioThriller","eng","","","","Misterio·Thriller·Terror","100","Misterio con grupo de terapia.","Lily Bard","1.0"
"More Aurora Teagarden Mysteries","Charlaine Harris","Ambientacion · Small town, Subgenero · Policiaco/Detective, Tono · Cozy/Ligero","","1.0","Charlaine Harris More Aurora Teagarden Mysteries In this acclaimed series starring part-time librarian and amateur sleuth Aurora Teagarden, #1 New York Times bestselling author Charlaine Harris ""mixes elements of a cozy and her darker themes with skill and panache"" (Publishers Weekly). Don't miss these three Southern-set mystery novels from the author of the Sookie Stackhouse series. 
Dead Over Heels A Fool and His Honey Poppy Done to Death
","eng","LMisterioThriller","eng","","","","Misterio·Thriller·Terror","100","Ómnibus de tres novelas de misterio cozy.","Aurora Teagarden","1.0"
"Small Kingdoms & Other Stories","Charlaine Harris","Formato · Antologia/Relatos, Genero · Misterio/Thriller, Tono · Identidad secreta, Tono · Morally grey/Antiheroe, Tono · Oscuro","","1.0","Principal Anne DeWitt knew her past could catch up with her, but she didn’t expect it would make her late for school. Killing a man does take time though; so does disposing the body . . . if you do it right. 
After three relatively quiet years at Travis High School, it seems Anne is in danger of being exposed—even the baseball coach knows more about her former life than she ever imagined. Now, she must find out who else holds her secrets and who wants her to pay for them. . .without letting it make her tardy again. Anne still has a school to run, parents to manage, and a few students who might benefit from her unique—and deadly—experience. 
Collected together for the first time in Small Kingdoms and Other Stories , “Small Kingdoms,” “Sarah Smiles,” “Small Chances,” and “Small Signs” are sure to delight fans of Charlaine Harris. 
","eng","LMisterioThriller","eng","","","","Misterio·Thriller·Terror","90","Colección de relatos de crimen y suspense.","",""
"Sweet and Deadly","Charlaine Harris","Ambientacion · Small town, Genero · Misterio/Thriller, Subgenero · Policiaco/Detective, Themes.Family Secrets","","1.0","Catherine Linton came home to Lowfield, Mississippi convinced that the untimely deaths of her parents in a car accident was no accident -- but nobody believed her. So she stayed, taking a job at the local paper, to try to both convince the sheriff that she was right-and maybe convince herself she was wrong. After all, her father had been the town doctor, loved (she always thought) by all. To think he was killed was to think that one of her friends or neighbors has harbored some deep resentment toward him. Then she finds the dead body of the women who had been her father's nurse for many years. Obviously murdered. Now Catherine knows that she was not wrong about her parent's death. Someone in Lowfield has a terrible secret, a secret worth killing for. Not once, not twice, but -- when another body is found -- three times. And the killer won't hesitate to add more victims to the list, as Catherine gets closer and closer to the truth. 
In *A Secret Rage* , former New York City model Nickie Callahan moves back to the South—before quickly learning that Knolls, Tennessee isn’t the quiet town she remembers from her youth. Someone is attacking women, and when the violence affects Nickie personally, she resolves to catch the assailant at any cost. 
In *Sweet and Deadly* , newspaper reporter Catherine Linton returns to the sleepy Southern town where she grew up after learning of her parents’ deaths in a car accident. She soon stumbles on the startling revelation that it wasn’t an accident at all—and that there are plenty of secrets hidden in places she least expects. 
Blending small-town Southern intrigue and harrowing suspense, these two crime novels will be sure to please fans of Charlaine Harris, #1 New York Times bestselling author of the Aurora Teagarden mysteries, which have been adapted by Hallmark Movies & Mysteries, and the Midnight, Texas series, recently adapted for television by NBC.
","eng","LMisterioThriller","eng","","","","Misterio·Thriller·Terror","90","Misterio sobre muertes sospechosas de los padres.","",""
"The Aurora Teagarden Mysteries: Omnibus 1","Charlaine Harris","Ambientacion · Small town, Subgenero · Policiaco/Detective, Tono · Cozy/Ligero","","1.0","THE AURORA TEAGARDEN MYSTERIES: An omnibus edition of Roe Teagarden's adventures!Aurora Teagarden loves reading about famous murderers - until she finds herself investigating a real-life killing spree!The first four novels in the Aurora Teagarden mysteries series. Lawrenceton, Georgia, may be a growing suburb of Atlanta, but it's still a small town at heart. Librarian Aurora Teagarden - Roe - grew up there, and she reckons she knows everything about her fellow townsfolk, including which ones share her interest in the darker side of human nature. 
This is omnibus edition contains four novels: Real Murders (book 1); A Bone to Pick (book 2); Three Bedrooms, One Corpse (book 3 ); The Julius House (book 4)
","eng","LMisterioThriller","eng","","","","Misterio·Thriller·Terror","100","Ómnibus de las primeras cuatro novelas de la serie.","Aurora Teagarden","1.0"
"The Lily Bard Mysteries Omnibus","Charlaine Harris","Genero · Misterio/Thriller, Subgenero · Policiaco/Detective, Tono · Oscuro","","1.0","Lily Bard is starting over again. She’s disguised herself as much as she can, cutting her hair short and wearing baggy clothes, and she's moved to Shakespeare, Arkansas, where, working as a cleaning lady, she can sweep away the secrets of her dark, violent past. Before long, everyone is going to know Lily Bard’s name.
","eng","LMisterioThriller","eng","","","","Misterio·Thriller·Terror","95","Misterio con protagonista que oculta su pasado, sin romance central.","Lily Bard","1.0"
"Unos asesinatos muy reales","Charlaine Harris","Ambientacion · Small town, Subgenero · Cozy mystery, Subgenero · Policiaco/Detective","Aurora Teagarden","1.0","El “Asesinato del Mes” de repente adquirió una dimensión muy violenta y… real 
Cada mes, Real Murders, una asociación de aficionados al crimen de Lawrenceton, Georgia, se reúne para discutir sobre un asesinato famoso. Sus miembros son de lo más excéntrico: Gifford Doakes, el especialista en masacres; Jane Engle, amante de las historias de terror victorianas; Perry Allison, fan de Ted Bundy… 
Durante la noche de la última reunión, la bibliotecaria local, Aurora «Roe» Teagarden, descubrió el cuerpo mutilado de Mamie Wright en la cocina de la sede del club. Está segura de que el asesino pertenece a la asociación, ya que el crimen guarda un parecido escalofriante con el Asesinato del Mes. 
Y como quiera que después tuvieron lugar otros asesinatos de imitación, el único móvil parece un aterrador y extraño sentido de la diversión …
","spa","LMisterioThriller","spa","","","","Misterio·Thriller·Terror","95","Club de aficionados al crimen con asesinatos imitación.","Aurora Teagarden","1.0"
"La paciencia de los huesos","Charlaine Harris","Ambientacion · Small town, Subgenero · Cozy mystery, Subgenero · Policiaco/Detective","Aurora Teagarden","2.0","Ir a dos bodas —una de ellas la de un antiguo amor— y al funeral de uno de los miembros del club, ya disuelto, de aficionados al estudio de crímenes mantiene muy ocupada a Aurora «Roe» Teagarden durante unos meses. Por desgracia, su vida personal parece estar en un punto muerto, hasta que su suerte cambia inesperadamente. 
Tras el funeral, Roe descubre que Jane Engle, la fallecida, la ha nombrado beneficiaria de una considerable herencia que incluye dinero, joyas y una casa con un cráneo oculto en la repisa de una ventana. Conociendo a Jane, Roe concluye que la anciana le ha dejado deliberadamente un asesinato por resolver. Por tanto, deberá identificar a la víctima y descubrir cuál de los vecinos de Jane, todos aparentemente normales y corrientes, es un asesino. Y todo ello sin ponerse ella en peligro de muerte…
","spa","LMisterioThriller","spa","","","","Misterio·Thriller·Terror","100","Misterio cozy con herencia y cráneo oculto.","Aurora Teagarden","1.0"
"Tres habitaciones y un cadáver","Charlaine Harris","Ambientacion · Small town, Subgenero · Cozy mystery, Subgenero · Policiaco/Detective","Aurora Teagarden","3.0","Un nuevo caso de la exitosa serie de Aurora Roe Teagarden. 
¿Quién está asesinando a las vendedoras inmobiliarias de Lawrenceton, Georgia? 
Es una pregunta tan sencilla como estremecedora, y la exbibliotecaria Aurora Teagarden es la persona adecuada para responderla. 
Mientras disfruta de una herencia que le permite una vida desahogada, Roe busca algo nuevo con lo que mantenerse ocupada. Cree que la venta de inmuebles puede ser divertida. ¿Y quién mejor para enseñarle los trucos del oficio que su madre, viva imagen de Lauren Bacall y propietaria de una de las inmobiliarias más importantes de la ciudad? 
Roe acepta mostrar una cara vivienda a unos clientes de fuera de la ciudad. La casa tiene su encanto, pero estos no parecen muy entusiasmados con lo que se encuentran en el dormitorio principal: el cadáver de otra vendedora llamada Tonia Lee Greenhouse. Y Tonia solo es la primera víctima. Pronto es evidente que el asesino es alguien familiarizado con la comunidad de vendedores inmobiliarios de Lawrenceton, alguien con acceso a las casas en venta. 
Roe, a fin de cuentas, no está muy segura de que este negocio le guste. No tenía previsto toparse con un asesinato. Pero lo que sí le gusta es su apuesto cliente, Martin Bartell. De hecho, puede que sea amor a primera vista.
","spa","LMisterioThriller","spa","","","","Misterio·Thriller·Terror","95","Misma novela que Three Bedrooms, One Corpse, misterio clásico.","Aurora Teagarden","1.0"
"La casa Julius","Charlaine Harris","Ambientacion · Small town, Subgenero · Cozy mystery, Subgenero · Policiaco/Detective","Aurora Teagarden","4.0","En la nueva entrega de la exitosa serie de Charlaine Harris, el amor a primera vista se convierte en felicidad absoluta de recién casados para la exbibliotecaria Aurora Roe Teagarden, hasta que la violencia interrumpe su luna de miel…  
Roe nunca se ha sentido tan feliz como desde que conoció a su prometido, el adinerado hombre de negocios Martin Bartell. A pesar de la diferencia de edad y de origen, él parece saber exactamente todo lo que ella desea, como la casa Julius…  
Roe, una especie de detective aficionada, está encantada cuando él le ofrece la casa como regalo de boda. Siempre le ha intrigado su historia, tristemente célebre. Hace seis años desapareció la familia que vivía ahí y nunca más se supo de ellos. Mientras Roe se lanza a restaurar la casa Julius, sus recelos acerca del pasado de Martin, bastante turbio, se alejan. Pero cuando Roe sufre el ataque de un maniaco armado con un hacha, se da cuenta de que los secretos que encierran esas cuatro paredes –y su flamante matrimonio– pueden destruirla.
","spa","LMisterioThriller","spa","","","","Misterio·Thriller·Terror","100","Misterio cozy ambientado en un pueblo pequeño.","Aurora Teagarden","1.0"
"Perdiendo la cabeza","Charlaine Harris","Ambientacion · Small town, Subgenero · Cozy mystery, Subgenero · Policiaco/Detective","Aurora Teagarden","5.0","A Aurora Roe Teagarden le caen los problemas del cielo en esta quinta entrega de la serie.  
Roe nunca se llevó bien con el sargento de detectives Jack Burns, pero eso no significa que quisiera verle muerto y mucho menos ver cómo le lanzaban desde una avioneta a su jardín. Afortunadamente, el cuerpo de policía de Lawrenceton, Georgia, sabe que es imposible que Roe pueda estar en dos sitios a la vez, así que su nombre queda tachado de la lista de sospechosos.  
A partir de ese momento, otros acontecimientos extraños empiezan a suceder en torno a Roe. Sucesos peculiares, violentos e incluso potencialmente mortales. Es evidente que detrás de toda esta locura hay un mensaje personal que Roe debe descifrar antes de que sea demasiado tarde.
","spa","LMisterioThriller","spa","","","","Misterio·Thriller·Terror","100","Misterio cozy con cuerpo arrojado desde avioneta.","Aurora Teagarden","1.0"
"De tal muerto tal astilla","Charlaine Harris","Ambientacion · Small town, Subgenero · Cozy mystery, Subgenero · Policiaco/Detective","Aurora Teagarden","6.0","«En ese instante ni lo sospechaba, pero un día tan absolutamente corriente estaba a punto de ir espectacularmente mal». La vida de Roe Teagarden parece haberse serenado. Su matrimonio con Martin va bien, ha recuperado su trabajo en la biblioteca de Lawrenceton y no se ha topado con ningún cadáver en bastante tiempo. Pero una tarde, el hombre que le trae la leña enloquece en su jardín y Roe presiente que se trata del comienzo de una sucesión de episodios desagradables. Muy pronto, sus sospechas se confirman. Regina, la sobrina de Martin, aparece con un bebé que nadie sabía que había tenido. En seguida, la joven desaparece dejando atrás al niño y a su marido, asesinado. Para encontrarla, Roe y Martin vuelven sobre los pasos de Regina conduciendo desde el soleado estado de Georgia hasta el nevado Ohio donde encontrarán un nido de oscuros secretos familiares. Secretos que harán peligrar sus vidas.  <p>""En ese instante ni lo sospechaba, pero un día tan absolutamente corriente estaba a punto de ir espectacularmente mal"". La vida de Roe Teagarden parece haberse serenado. Su matrimonio con Martin va bien, ha recuperado su trabajo en la biblioteca de Lawrenceton y no se ha topado con ningún cadáver en bastante tiempo. Pero una tarde, el hombre que le trae la leña enloquece en su jardín y Roe presiente que se trata del comienzo de una sucesión de episodios desagradables. Muy pronto, sus sospechas se confirman. Regina, la sobrina de Martin, aparece con un bebé que nadie sabía que había tenido. En seguida, la joven desaparece dejando atrás al niño y a su marido, asesinado. Para encontrarla, Roe y Martin vuelven sobre los pasos de Regina conduciendo desde el soleado estado de Georgia hasta el nevado Ohio donde encontrarán un nido de oscuros secretos familiares. Secretos que harán peligrar sus vidas.</p>  «En ese instante ni lo sospechaba, pero un día tan absolutamente corriente estaba a punto de ir espectacularmente mal». La vida de Roe Teagarden parece haberse serenado. Su matrimonio con Martin va bien, ha recuperado su trabajo en la biblioteca de Lawrenceton y no se ha topado con ningún cadáver en bastante tiempo. Pero una tarde, el hombre que le trae la leña enloquece en su jardín y Roe presiente que se trata del comienzo de una sucesión de episodios desagradables. Muy pronto, sus sospechas se confirman. Regina, la sobrina de Martin, aparece con un bebé que nadie sabía que había tenido. En seguida, la joven desaparece dejando atrás al niño y a su marido, asesinado. Para encontrarla, Roe y Martin vuelven sobre los pasos de Regina conduciendo desde el soleado estado de Georgia hasta el nevado Ohio donde encontrarán un nido de oscuros secretos familiares. Secretos que harán peligrar sus vidas.","spa","LMisterioThriller","spa","","","","Misterio·Thriller·Terror","95","Spanish edition of A Fool and His Honey; cozy mystery with baby and murder.","Aurora Teagarden","1.0"
"Muerta y... ¡Acción!","Charlaine Harris","Ambientacion · Small town, Subgenero · Cozy mystery, Subgenero · Policiaco/Detective","Aurora Teagarden","7.0","Cuando un equipo de Hollywood aterriza en la pequeña ciudad de Lawrenceton, Georgia, la bibliotecaria a tiempo parcial Roe tiene la oportunidad de observar cómo se hace una película… hasta que un asesinato le hace retomar su papel como detective amateur. Ha pasado más de un año desde la muerte de su marido, Martin, y Roe Teagarden todavía está de luto. Lo único que quiere es que la dejen sola con su tristeza. Eso resulta imposible cuando un equipo cinematográfico llega a Lawrenceton. Ha venido a rodar una película basada en un libro escrito por su antiguo novio Robin Crusoe, un libro que detalla la investigación de ambos en una serie de asesinatos ocurridos años atrás. Los lugareños están encantados; Roe, no. No obstante, Robin empieza a involucrarla cuando descubren que la actriz protagonista —que interpreta a Roe— ha sido asesinada. Una vez más los dos unen sus fuerzas para frustrar los planes de un asesino... sin saber que el siguiente objetivo es la propia Roe.","spa","LMisterioThriller","spa","","","","Misterio·Thriller·Terror","100","Misterio cozy con rodaje de película.","Aurora Teagarden","1.0"
"Muerte en el club de lectura","Charlaine Harris","Ambientacion · Small town, Subgenero · Cozy mystery, Subgenero · Policiaco/Detective","Aurora Teagarden","8.0","Poppy, la cuñada de Roe, ha aparecido ensangrentada y muerta en la puerta trasera de su casa. Es cierto que Poppy tenía sus defectos, y que ella y su marido estaban teniendo serios problemas para mantenerse fieles el uno al otro, pero desde luego no se merecía ser brutalmente asesinada. 
La investigación de un caso como este nunca es fácil dada la atmósfera chismosa de cualquier pueblo pequeño. Y menos teniendo en cuenta los romances extramatrimoniales de la asesinada y la necesidad de proteger a su familia. Además, «Roe» también está viviendo una incipiente relación romántica y la aparición repentina de su medio hermano adolescente. 
Demasiadas cosas para una sola persona… incluso para una mujer tan equilibrada como Roe.
","spa","LMisterioThriller","spa","","","","Misterio·Thriller·Terror","100","Misterio cozy con asesinato en club de lectura.","Aurora Teagarden","1.0"
