title,authors,tags,series,series_index,comments,languages,library_name,#language_code,#world,#subjects,#info,#libreria,#confianza_ia,#motivo_ia,#serie_ia,#serie_ia_index
"Inside Traitor","B. P. Stevens","Genero · Misterio/Thriller, Subgenero · Policiaco/Detective","Silencer","2.0","When the public turns against you, what options do you have? As Emma Pepper and her squad continue hunting down the Silencer, they begin to discover secrets that could completely derail the case. Who is the Silencer? Why did he kill who he killed? And is there more to the story than the police know? The more they study the Silencer, the clearer it becomes that not only is the squad dealing with a serial killer, they are dealing with a pro. He continues to evade forensic evidence and hide from the police in this police procedural series, but that’s not all that Emma has to deal with. Hiding under the prying eyes of her bosses, the squad and Emma feel like they’re being rushed to find the Silencer - or they may lose their jobs. Things only take a turn for the worse when a story breaks on the local news and the Silencer becomes a local hero, not a villain. What can the police do now that the public doesn’t want the Silence behind bars? Who leaked the story? And in the midst of all the drama, can Emma somehow find a way to uncover who the Silencer is before he silences her?","eng","LMisterioThriller","eng","","","","Misterio·Thriller·Terror","95","Continúa la caza del Silencer; presión pública y secretos internos.","Silencer","1.0"
"Caught in the Crosshairs","B. P. Stevens","Genero · Misterio/Thriller, Subgenero · Policiaco/Detective","Silencer","3.0","With her reputation on the line, Detective Pepper has nowhere to turn… As Detective Emma Pepper struggles to clear her name, all eyes are on her. All of her friends think that she betrayed all of them, and even Emma has to admit that they’ve got a point. When the press gets wind of these secrets, things only get worse… But who told the press? In this police mystery, Emma is suddenly in the crosshairs. With the Silencer still free on the streets, and questions at every corner, Emma realizes she’s in danger. No one believes her, and she is stuck carrying the weight of secrets she never intended to keep. But now, she feels like she’s being watched. Who’s watching? Do they want her dead, or do they want her help? Will Emma be able to survive the mountain of secrets she is falling into, or will it swallow her whole?","eng","LMisterioThriller","eng","","","","Misterio·Thriller·Terror","95","Policiaco/thriller con detective persiguiendo a un asesino en serie, sin romance central ni elementos fantásticos.","Silencer","1.0"
"Hunt Down","B. P. Stevens","Genero · Misterio/Thriller, Subgenero · Policiaco/Detective","Silencer","1.0","Emma Pepper loves her job. As an NYPD detective, she has her eyes set on rising up in her career. She knows she can do it, and she knows she’s good at it. Being a good detective comes easy to her… but it seems catching the infamous serial killer, The Silencer, gives her pause. As the infamous killer continues to evade the police, Emma’s boss calls in help from the small-town police force, now known for stopping a bad cop named Andrew. Now, Emma is feeling a little crowded with the new cops crowding her space. However, she knows better than anyone with this killer, they need all the help that they can get. But, as clues and secrets start piling up, the serial killer seems to be the farthest thing from what they expected. It seems that suddenly, The Silencer is out for blood, and the police are running out of time before he strikes again. In this police thriller, follow in the steps of Emma Pepper and Harper Storm as they hunt down another bad man - hopefully before he hunts them.","eng","LMisterioThriller","eng","","","","Misterio·Thriller·Terror","95","Emma Pepper y Harper Storm colaboran contra el asesino en serie Silencer; thriller policiaco.","Silencer","1.0"
"Chasing Memories","B. P. Stevens","Genero · Misterio/Thriller, Representacion · Protagonista femenina fuerte, Subgenero · Policiaco/Detective","Shadow-Man","2.0","After chasing down who she was sure was the Shadow Man, Harper Storm finds herself face to face with the harsh reality of the world of cold cases. Injuries, crazy truths, and the idea that someone within the precinct might be hurting the case begin to unveil and threaten to tear Harper’s world apart. That is until she’s forced to reveal a horribly painful truth to everyone she knows… One that could cost her the case.  B.P Stevens kidnapping thrillers are perfect if you are trying to find police books with conclusions you didn't see coming!","eng","LMisterioThriller","eng","","","","Misterio·Thriller·Terror","95","Thriller policíaco con Harper Storm y el caso del Shadow Man, secuestro de niños.","Shadow-Man","1.0"
"Dead Man Walking","Duncan Wallace","Subgenero · Policiaco/Detective","DCI Ben Nevis","1.0","Detective Mike O’Connor is a grizzled veteran of the force who has seen it all and wouldn’t admit to having any soft spots. But he wasn’t prepared for his former partner to become the victim of a psychotic stalker. He will have to keep his emotions separate from his work, because what begins as a stalking case will rapidly turn into something far bigger, and more sinister, than anyone could have expected.","eng","LMisterioThriller","eng","","","","Misterio·Thriller·Terror","100","El detective O'Connor investiga un caso de acoso que deriva en algo más siniestro.","DCI Mike O'Connor","1.0"
"Cold Blooded","Duncan Wallace","Subgenero · Policiaco/Detective","DCI Murray & Burns","3.0","Everybody has got a past. Some people hope others will never find out about it. Some people would kill to do so. It's up to inspectors Murray and Burns to bring them to justice.","eng","LMisterioThriller","eng","","","","Misterio·Thriller·Terror","100","Los inspectores Murray y Burns investigan un asesinato vinculado a secretos del pasado.","DCI Murray","1.0"
"Vile Experiment","Duncan Wallace","Subgenero · Policiaco/Detective","DCI Kirk Ross","4.0","DCI Kirk Ross is first on the scene of a body found in the woods with surgical wounds and hideous, infected stitching.   
The grim possibilities are endless: organ harvesting scheme? Unlicensed surgeon? A serial killer with a penchant for torture?  
If Ross can’t crack the case, the bodies will pile up and the DCI may find himself the last victim.
","eng","LMisterioThriller","eng","","","","Misterio·Thriller·Terror","95","DCI Kirk Ross investigates body with surgical wounds; serial killer elements. Part of a series.","DCI Kirk Ross series","1.0"
"Fatal Mercy","Duncan Wallace","Subgenero · Policiaco/Detective","Ian Forsyth MI5 Detective","2.0","The local police have asked retired spy Ian Forsyth to help investigate a series of deaths at a private cancer hospital, and he is more than happy to use his peculiar set of skills to do it.But what seemingly starts out as an investigation into a rogue doctor quickly becomes a conspiracy involving the most powerful members of society and international corporations bent on exploiting the most vulnerable.A conspiracy big enough to commit murder to keep secret.","eng","LMisterioThriller","eng","","","","Misterio·Thriller·Terror","100","Exespía investiga muertes en un hospital oncológico; conspiración corporativa.","Ian Forsyth","1.0"
"Cultish Following","Duncan Wallace","Subgenero · Policiaco/Detective","Inspector Finlay Files","2.0","Maisie Kirkwood left her parents’ home two years ago and hasn’t been seen since. Now, a homeless man has been found with the missing girl’s backpack and ID. His story will send Inspector Glenn Finlay on a race across Scotland, from the hustle and bustle of modern Edinburgh to a mysterious building deep in the forested highlands. It’s up to Scotland’s best detective to follow the trail of the missing girl and unravel the clues that will unmask a dark truth that has been buried for far too long.","eng","LMisterioThriller","eng","","","","Misterio·Thriller·Terror","100","Inspector Glenn Finlay sigue la pista de una joven desaparecida; misterio con trasfondo de secta.","Inspector Glenn Finlay","1.0"
"Blue Vengeance","Duncan Wallace","Subgenero · Policiaco/Detective","Logan Thorne DCI","1.0","When the Chief Constable is found dead, everyone looks to DCI Logan Thorne to solve the case. But once he finds a taunting message from the killer with the threat to strike again, there is only one a serial cop killer is on the loose.   
Will Thorne find him before he strikes again?   
Or is Thorne the next victim?
","eng","LMisterioThriller","eng","","","","Misterio·Thriller·Terror","95","Jefe de policía asesinado, asesino en serie de policías; thriller detectivesco.","DCI Logan Thorne","1.0"
"Dark Obsession","Duncan Wallace","Subgenero · Policiaco/Detective","DCI Argyle Investigations","1.0","DCI Sean Argyle has the unenviable task of catching a serial killer, and all the evidence points to a suspect thousands of miles away.   
Common sense would indicate that there is another suspect, or that the killer has an accomplice, but Argyle is more worried by an even more bone-chilling possibility.   
What if the real killer is indeed thousands of miles away? And worse, how do you stop him?
","eng","LMisterioThriller","eng","","","","Misterio·Thriller·Terror","100","Caza de un asesino en serie con pistas que apuntan a un sospechoso lejano; thriller policiaco.","DCI Sean Argyle","1.0"
"Blood on the Harbour","Duncan Wallace","Subgenero · Policiaco/Detective","MIS Alasdair","1.0","A strange murder. An abducted family. A case with no leads. Murder Investigation Specialist Alasdair Abernathy has to cut through the fog, figuratively and literally, to save a family before they are murdered to settle an unknown vendetta. Or he might become the next victim.","eng","LMisterioThriller","eng","","","","Misterio·Thriller·Terror","95","Asesinato extraño y familia secuestrada; thriller policiaco con niebla.","Alasdair Abernathy","1.0"
"A Family Affair","Duncan Wallace","Subgenero · Policiaco/Detective","Inspector Finlay Files","1.0","Blood runs thicker than water, but it still runs. When Inspector Glenn Finlay responds to the scene of the murder of a wealthy patriarch, he quickly realizes that what looked like a palatial estate was in fact a den of vipers. Everyone is a suspect, everyone has a motive, and only Scotland’s best detective can crack the case before the killer covers their tracks… or strikes again.","eng","LMisterioThriller","eng","","","","Misterio·Thriller·Terror","95","Inspector investiga asesinato de un patriarca; thriller policiaco en Escocia.","Inspector Glenn Finlay","1.0"
"Death Behind Silent Walls","Blythe Baker","Genero · Misterio/Thriller","Victoria Sedgewick Mystery","1.0","After her husband dies under suspicious circumstances, Victoria Sedgewick is drawn down a dark and spiraling path of family secrets. There, she uncovers a deception so deep it threatens to destroy everything she holds dear.  Will the private inquiry agent investigating her husband’s murder complicate matters? Or might Mr. Branwell Keats prove to be an ally, as a growing shadow of danger looms over Victoria’s household?","eng","LMisterioThriller","eng","","","","Misterio·Thriller·Terror","95","Continuación del misterio victoriano de Victoria Sedgewick.","Victoria Sedgewick Series","1.0"
"A Drink of Death","Blythe Baker","Tono · Cozy/Ligero","Japanese Tea Garden Mysteries","2.0","**When tea and death mix ...** Maddie Morgan hasn't had long to recover from a recent murder investigation and to settle back into running her new tea garden, when disaster strikes again. Like most catastrophes, this one involves Mamma Jackie and her crazed old parrot. With the clock ticking down and time running out, can Maddie save Mamma Jackie from the clutches of a fiendish villain? Or will the mysteries of her ex-mother-in-law's disappearance and Maddie's strange discovery of a lucky cat statue be doomed to remain unsolved forever?","eng","LMisterioThriller","eng","","","","Misterio·Thriller·Terror","95","Otro cozy mystery de Maddie Morgan con el jardín de té.","Maddie Morgan Series","1.0"
"A Simple Country Murder","Blythe Baker","Genero · Misterio/Thriller","Helen Lightholder Murder Mystery","1.0","**Murder. Spies. Treason. Shadowy secrets lurk beneath the surface of an idyllic country village...** When Helen Lightholder’s world is shattered by the death of her husband during the London Blitz, she escapes to the countryside, hoping to leave the war behind her. But managing an inherited property in a quaint Gloucestershire village turns out to be more perilous than she expects. Cozy little Brookminster isn’t the peaceful haven Helen dreamed of, and it isn’t long before she discovers that, even here, dark threats and dangerous secrets await. As family duty compels her to meddle in a police investigation into the suspicious death of a relative, she finds herself at odds with the local inspector. Can Helen bring justice to her little corner of the country, while war rages on in the greater world outside? Or will her investigation make her the next target of a fiendish killer who has everything to lose?","eng","LMisterioThriller","eng","","","","Misterio·Thriller·Terror","95","Mismo estilo y protagonista, misterio rural.","Helen Lightholder Series","1.0"
"A Simple Country Funeral","Blythe Baker","Genero · Misterio/Thriller","Helen Lightholder Murder Mystery","2.0","**Death returns to the country ...** A quiet country life continues to elude Helen Lightholder, as she wrestles with her recent bereavement. When the grisly murder of a nameless vagabond shocks the local community, Helen sets out to unearth the truth behind the inexplicable killing. But Bookminster hides secrets almost as old as it’s 14th century market place, and the village’s inhabitants will do anything to thwart a prying outsider. Helen’s snooping at a convalescent home for wounded soldiers leads to an apparent dead end, even as other obstacles loom in her path. With Inspector Graves blocking her investigation at every turn and a mysterious, shadowy figure continuing to dog her steps, can Helen unmask the most dangerous killer she has ever faced?","eng","LMisterioThriller","eng","","","","Misterio·Thriller·Terror","95","Misterio cozy ambientado en un pueblo durante la Segunda Guerra Mundial.","Helen Lightholder Series","1.0"
"A Taste of Trickery","Blythe Baker","Tono · Cozy/Ligero","Japanese Tea Garden Mysteries","3.0","**When tea tastes like danger ...** Maddie’s difficult ex-mother-in-law and her crazed old parrot are at it again, stirring up new drama in the Morgan household. Maddie has no sooner resolved the last crises involving her family, than a new problem arrives in the form of a dangerous business rival determined to shut down her tea garden. To make matters worse, a severed hand has just been found in the tea garden and no one seems to know where it’s come from! Can Maddie discover the truth and unravel an old crime before the perpetrator gets close enough to end her investigation permanently? Or has Maddie Morgan donned her detective hat and her gardening gloves for the last time?","eng","LMisterioThriller","eng","","","","Misterio·Thriller·Terror","95","Continúa la serie cozy mystery de Maddie.","Maddie Morgan Series","1.0"
"A Sip of Murder","Blythe Baker","Tono · Cozy/Ligero","Japanese Tea Garden Mysteries","1.0","**When tea and murder make a bitter brew ...** Maddie Morgan’s life is going up in flames. She’s got ex-husband troubles, a mother-in-law feud, and a cantankerous parrot to contend with. But just as old doors close, a new one opens, beginning with the sudden death of Maddie’s grandmother and an unexpected inheritance. Moving to a new town, Maddie rolls up her sleeves and prepares to revive a run-down tourist attraction that could one day be returned to its former glory as a Japanese tea garden. But getting the tea garden up and running won’t be easy, not with someone trying to sabotage her efforts. Worse still, there’s a murderer on the loose and corpses are popping up like daisies in the tea garden! Can Maddie capture the killer before they strike again? Or will her life, along with her freshly brewed new business opportunity, get sucked down the drain?","eng","LMisterioThriller","eng","","","","Misterio·Thriller·Terror","95","Cozy mystery con jardín de té, sin elementos sobrenaturales.","Maddie Morgan Series","1.0"
"A Simple Country Mystery","Blythe Baker","Genero · Misterio/Thriller","Helen Lightholder Murder Mystery","3.0","**Death comes unexpectedly ...** With the suspicious death of a young woman in the village, Helen Lightholder finds herself once again delving into the menacing shadows that lurk beneath the pleasant surface of sunny Bookminster. Her search for suspects and motives leads her to a prisoner of war camp on the outskirts of the village, but could the real danger lie even closer to home?  Meanwhile, two very different men vie for Helen’s heart, but neither can take the place of the husband she lost. As a series of break-ins leave her feeling unsafe in her home and shop, Helen has to decide whether or not to continue in the “quiet” life she has found in the country.","eng","LMisterioThriller","eng","","","","Misterio·Thriller·Terror","95","Continúa las investigaciones de Helen Lightholder.","Helen Lightholder Series","1.0"
"Killing the Pretty Ones","Duncan Wallace","Subgenero · Policiaco/Detective","DCI Ben Nevis","4.0","After a series of attractive young women are brutally murdered, DCI Mike O’Connor sets his sights on tracking down the perpetrator. Once he determines the link between the victims is the shady world of online escort services, he will have his hands full convincing an American corporation to release the confidential client information he needs to crack the case before the modern day Ripper can strike again.","eng","LMisterioThriller","eng","","","","Misterio·Thriller·Terror","100","Jóvenes asesinadas vinculadas a servicios de acompañantes; caza de un asesino en serie.","DCI Mike O'Connor","1.0"
"Murder and Privlege","Duncan Wallace","Subgenero · Policiaco/Detective","DCI Argyle Investigations","3.0","In the picturesque town of St Andrews, the heir to the famous Lacteus family fortune has been found dead in the estate swimming pool. The local police quickly determine that it wasn’t an accident, and DCI Argyle and Inspector McFayden are called in to investigate. Scotland’s best detectives will have to unravel a tangled family history and the damaged relationships between the surviving members of the Lacteus clan if they hope to catch a killer intent on destroying the family’s empire.","eng","LMisterioThriller","eng","","","","Misterio·Thriller·Terror","100","Muerte del heredero de una fortuna; investigación de una familia adinerada.","DCI Sean Argyle","1.0"
"Killing Lady Macbeth","Duncan Wallace","Subgenero · Policiaco/Detective","DCI Argyle Investigations","4.0","When the actress playing Lady MacBeth is savagely murdered just offstage during the play, all the eyes of Inverness are turned toward DCI Argyle as he attempts to bring the killer to justice.    The murder is just the tip of the iceberg as Sean and Edel uncover the depths of a conspiracy by one of the oldest secret societies in Scotland.    If they pry too far into long-hidden mysteries, the inspectors may find themselves the next victims.","eng","LMisterioThriller","eng","","","","Misterio·Thriller·Terror","100","Actriz asesinada durante una obra; investigación que involucra una sociedad secreta.","DCI Sean Argyle","1.0"
"Burn the Witch","Duncan Wallace","Subgenero · Policiaco/Detective","DCI Ben Nevis","3.0","Some superstition is harmless, some superstition is just good fun, but some superstitions are deadly serious.    When two occult related murders rock the highlands, DCI Mike O’Connor will find that the clues to each lead in the same direction: a circle of evil that will stop at nothing to protect itself.","eng","LMisterioThriller","eng","","","","Misterio·Thriller·Terror","100","Novela policiaca centrada en un asesinato relacionado con el ocultismo, sin elementos sobrenaturales reales ni romance central.","DCI Mike O'Connor","1.0"
"Running Bones","Duncan Wallace","Subgenero · Policiaco/Detective","MIS Alasdair","2.0","Detective Alasdair Abernathy is called in to assist with a missing person case where nothing is what it seems. A well-loved community member disappeared during his daily run, and no shortage suspects are competing with each other to… confess to his murder? It won’t be easy to cut through the web of lies, betrayal, and deceit in order to crack this case, but if he doesn’t, a killer will remain at large among us.","eng","LMisterioThriller","eng","","","","Misterio·Thriller·Terror","100","Persona desaparecida durante su carrera; múltiples confesiones falsas.","Inspector Alasdair Abernathy","1.0"
"Hunting a Monster","Duncan Wallace","Subgenero · Policiaco/Detective","Logan Thorne DCI","4.0","When Edinburgh is rocked by a murder so violent and gruesome that it appears to be the work of gang of perpetrators, DCI Logan Thorne is called in to begin the hunt.  But what if the killer is operating alone? Does one man have the titanic strength needed to kill two others at the same with only his bare hands?  What if Logan isn’t trying to catch a man at all?  What if a monster roams the streets of Edinburgh at night?","eng","LMisterioThriller","eng","","","","Misterio·Thriller·Terror","100","Asesinato brutal en Edimburgo; posible asesino en serie con fuerza sobrehumana, pero sin sobrenatural.","DCI Logan Thorne","1.0"
"Dirge for the Girl","Duncan Wallace","Subgenero · Policiaco/Detective","Logan Thorne DCI","2.0","A young woman is missing on the Isle of Skye. The locals believe she has run away, but Logan’s not so sure. When a body is found, the finger pointing begins. Was it the jealous ex-boyfriend, the angry step-father, or somebody no one’s even considered yet?  Things are made more difficult by a local constabulary that’s leery of outsiders and a nosy writer hoping for an inside scoop for his next novel. It’s up to DCI Thorne and DI Harding to unearth the dark secrets of a small town and unravel the mystery of a teen-ager’s death before the killer selects his next victim.","eng","LMisterioThriller","eng","","","","Misterio·Thriller·Terror","100","Desaparición y asesinato en la Isla de Skye; misterio rural con múltiples sospechosos.","DCI Logan Thorne","1.0"
"Spying on the Killer","Duncan Wallace","Subgenero · Policiaco/Detective","Ian Forsyth MI5 Detective","1.0","Retired MI5 agent Ian Forsyth wanted nothing more than to peacefully enjoy his newfound freedom, but his relaxation is interrupted by the suicide of a friend’s child.    Suspicious at the circumstances and rebuffed by the police, Ian is forced to take the investigation into his own hand.    But as he pulls on the thread, he will find something deeper and darker than he could have ever foreseen, and it will take all his skills as a former clandestine spy to expose the truth and obtain justice.","eng","LMisterioThriller","eng","","","","Misterio·Thriller·Terror","95","Retired MI5 agent investigates suspicious suicide; no romance, no fantasy/sci-fi. Clear mystery/thriller.","",""
"Scorched Bones","Duncan Wallace","Subgenero · Policiaco/Detective","DCI Murray & Burns","2.0","A homicidal arson. A mysterious body. An affair of the heart.    DCI Murray and Sergeant Burns have to solve a horrific crime where the obvious motives don’t match the few clues available.    If they do not, a murderer with no qualms about burning an innocent family to death will strike again.","eng","LMisterioThriller","eng","","","","Misterio·Thriller·Terror","100","Incendio provocado con víctimas; investigación de un pirómano asesino.","DCI Murray","1.0"
"Murder on the North Sea","Duncan Wallace","Subgenero · Policiaco/Detective","DCI Ben Nevis","2.0","DCI O’Connor is enjoying a rare day off when his partner calls with a request. A dead body has been found in the kitchen of the cruise ship she’s on, but with half of Edinburgh trying to escape the summer’s heat, it will be hours before the officer on duty arrives. And time is ticking away, as the police can only keep the ship in the harbor for twenty-four hours while they hunt for the killer. But who among this boatload of strangers would want to kill the beautiful Italian with the unquenchable need for sex?","eng","LMisterioThriller","eng","","","","Misterio·Thriller·Terror","100","Asesinato en un crucero; la víctima tenía una vida sexual activa, pero el foco es el misterio.","DCI Mike O'Connor","1.0"
"Channeling the Dead","Duncan Wallace","Subgenero · Policiaco/Detective","DCI Argyle Investigations","5.0","An occult seance.    A gruesome death.    Disappeared children.  DCI Argyle is called to the picturesque holiday town of St. Monans to investigate a strange death, but when there are no obvious signs of foul play, his superiors want to close the case. But Argyle will have to fight to keep the case open, since the small town is about to be torn apart by a modern day witch-hunt. If he doesn’t put the pieces together in time, there will be a bloodbath in the seaside village.","eng","LMisterioThriller","eng","","","","Misterio·Thriller·Terror","100","Investigación de una muerte en una sesión de espiritismo, pero sin magia real; misterio policiaco.","DCI Sean Argyle","1.0"
