title,authors,tags,series,series_index,comments,languages,library_name,#language_code,#world,#subjects,#info,#libreria,#confianza_ia,#motivo_ia,#serie_ia,#serie_ia_index
"Chocolate Hearts and Murder","Patti Larsen","Genero · Fantasia, Paranormal · Brujas/Magos, Tono · Cozy/Ligero","Fiona Fleming Cozy Mysteries","2.0","A Multiple Drink Kind of Night  Why was it fancy Valentine’s Day drinks were always tinted red? Reminded me more of gore and mayhem than anything to do with romance. Which said a lot, I suppose, for my state of mind when it came to relationships and dating.  No bitterness in Fiona Fleming toward the opposite sex or anything.  I sipped carefully at the mimosa the bartender smilingly handed me and shrugged off the sweetness. It had alcohol in it, so I guess it would do. A few of these and I might even find a way to enjoy myself tonight. Yeah, right.  Fiona Fleming would rather be home, at her bed and breakfast with her pug Petunia snuggled up to her while everyone else celebrates Valentine’s Day without her, thank you very much. Instead, she’s been recruited to attend another of Mayor Olivia Walker’s Reading, Vermont tourism promotion events. But when the young majority stakeholder in the White Valley Ski Lodge ends up dead, she’s ready and willing to help Sheriff Crew Turner and her father uncover who killed their victim while a snowstorm cuts them off from the rest of the world.","eng","LMisterioThriller","eng","","","","Misterio·Thriller·Terror","95","Misterio durante celebración de San Valentín con tormenta de nieve.","Fiona Fleming Cozy Mysteries","1.0"
"Fame and Fortune and Murder","Patti Larsen","Genero · Fantasia, Paranormal · Brujas/Magos, Tono · Cozy/Ligero","Fiona Fleming Cozy Mysteries","3.0","An Insulting Kind of Day  I skipped around a small stack of pylons while my deputy cousin unloaded more of the same from the back of the sheriff’s pickup. I beamed at Robert Carlisle, not because I adored him. Quite the opposite. I couldn’t stand the wretched little piece of loathing with his seventies-esque bush of a black mustache or his pompous superiority that he got to be a cop and I didn’t or his growing beer belly and hideous leer he liked to aim at any woman under the age of fifty.  No, I grinned and waved out of sheer delight at his less than enthusiastic expression as he grunted his way through hefting a rather heavy looking barricade onto the sidewalk.  “Exercise is good for you,” I said as I kept going without offering to help.  “Your ass could use some lately, Fanny,” he shot after me.  He did not just call me fat and Fanny in the same sentence.  Fiona Fleming has no intention of getting involved when Mayor Olivia Walker hosts a parade for the celebrity couple whose fame she’s been using to promote their town. But when the local ski lodge can’t accommodate and Willow Pink and Skip Anderson end up staying at Petunia’s, Fee is not only front row center to a murder, she’s trapped in her own bed and breakfast with the suspects when the frenzied media descends on Reading looking for the story of a lifetime.","eng","LMisterioThriller","eng","","","","Misterio·Thriller·Terror","95","Misterio con celebridades alojadas en la posada y un asesinato.","Fiona Fleming Cozy Mysteries","1.0"
"Ganache and Fondant and Murder","Patti Larsen","Genero · Fantasia, Paranormal · Brujas/Magos, Tono · Cozy/Ligero","Fiona Fleming Cozy Mysteries","5.0","**A fifth cozy mystery installment to die for!**   *Not to be indelicate about it, but if Mom made me eat one more bite of cake, I was going to throw up. I'd honestly ingested enough dessert in the last hour to sink a submarine with no end in sight.  Don't get me wrong. I loved my mother's baking. But a girl has her limits, and I had finally reached mine, groaning, burping softly around the chocolate, vanilla, red velvet, buttercream and banana that swam on the surface of a variety of other flavors I'd rather not taste again in reverse. ** *With renovations of the new annex to Petunia's in full swing, Fiona's life might be more in order, but her habit of digging into criminal cases hasn't changed one bit. Doesn't help when her mother is on the suspect list, the death of a famous cooking show judge leading Fee into the dark side of bake offs, television and murder.  **Don't miss a single volume in the Fiona Fleming Cozy Mysteries! Find books one through four available now:   Bed and Breakfast and Murder   Chocolate Hearts and Murder   Fame and Fortune and Murder   Ghosts and Goblins and Murder**","eng","LMisterioThriller","eng","","","","Misterio·Thriller·Terror","95","Muerte de un juez de concurso de cocina, madre de Fee sospechosa.","Fiona Fleming Cozy Mysteries","1.0"
"Ropes and Trees and Murder","Patti Larsen","Genero · Fantasia, Paranormal · Brujas/Magos, Tono · Cozy/Ligero","Fiona Fleming Cozy Mysteries","6.0","A sixth cozy mystery installment to die for!  A Dangling Kind of Minute  ""Have dinner with me tonight."" The gruffness of Crew's voice made me shiver all over, especially when he didn't move after speaking, mouth grazing over my earlobe, faint trace of his teeth nibbling at the edge. He was lucky we were thirty feet up on a narrow platform because had we been on the ground? He'd have been at risk of a hard landing and some rather private activity that may or may not have ended in the pair of us getting arrested.  Seriously. Yum.  Now that the annex is ready to open and her romance with Crew is budding with spring, Fee prepares for the wedding of the year while trying to balance her mother's continuing self-confidence issues and her own rapidly expanding business. An afternoon of zip lining at a new park seems like a great way to let off some steam--until an activist protesting the park is found murdered. Once again in the middle of a murder investigation, Fee finds working with Crew instead of against him puts her in more danger than ever!  Don't miss a single volume in the Fiona Fleming Cozy Mysteries! Find books one through five available    Bed and Breakfast and Murder   Chocolate Hearts and Murder   Fame and Fortune and Murder   Ghosts and Goblins and Murder   Ganache and Fondant and Murder","eng","LMisterioThriller","eng","","","","Misterio·Thriller·Terror","95","Misterio en parque de tirolinas, tono cozy.","Fiona Fleming Cozy Mysteries","1.0"
"Anchors Away and Murder","Patti Larsen","Genero · Fantasia, Paranormal · Brujas/Magos, Tono · Cozy/Ligero","Fiona Fleming Cozy Mysteries","7.0","A seventh cozy mystery installment to die for!  A Crew-less Kind of Week  “Good morning, Sheriff. How’s Montpelier?” He and Jill were at a conference in the state capital, gone since last Sunday night. He’d been great to keep in touch, calling when he knew I’d be alone, usually about this time of day and again late enough at night we had lots of time to talk. Did he really know me that well, my schedule? Apparently. Made me feel a happy little bubble of joy, like we were really a couple. Weren’t we?  “Good morning, Miss Fleming,” he said in that deep gravel voice of his that made me shiver and grin all over again. “I’m bored silly, ready to come home tomorrow and wishing you’d come with me instead of Jill.”  Well, growl, Sheriff Turner.  With Petunia’s and the annex packed to the brim, Fee’s business is booming. When the yacht club’s president dies under mysterious circumstances, she discovers her bed and breakfast isn’t her only source of employment. Newly partnered with her father in Fleming Investigations, Fee reaches out to Crew to come home and solve the case. Trouble is, he’s vanished and no one will tell her where he’s gone. Worst of all? That leaves Robert, of all people, sitting in the sheriff’s seat to head butt with Fee and John with Olivia’s job again in the balance. (PLEASE The choice of AWAY instead of AWEIGH in the title is intentional!)","eng","LMisterioThriller","eng","","","","Misterio·Thriller·Terror","95","Misterio en el club de yates con desaparición del sheriff.","Fiona Fleming Cozy Mysteries","1.0"
"Guns and Ammo and Murder","Patti Larsen","Genero · Fantasia, Paranormal · Brujas/Magos, Tono · Cozy/Ligero","Fiona Fleming Cozy Mysteries","8.0","An anxious kind of month  “Any new threats against you?” Pamela seemed eager for my answer while I tsked at her.  “Are you actually asking me if I’ve had any further nasty messages left in my mailbox?” There’d been more than a few since she’d gleefully published my first column. I figured there’d be pushback, but threatening to hurt my dog, my business and my koi? Unacceptable. And while Crew seemed to think none of the threats were real, he was still worried, though he never once asked me to stop writing because he was a smart, smart boy.  Tensions are high as a pending election pits incumbent mayor Olivia Walker against Patterson lackey Geoffrey Jenkins, threatening Crew’s job as sheriff and his place in Reading. Fee and her mother, meanwhile, agree to assist the owner of a new hunting retreat with the first batch of guests. To their horror, not only are they cut off from the rest of Reading by an accidental beaver dam demolition, they are forced to investigate a murder while Fee wrestles with her past and the fact she’s still not over her ex.  Don't miss a single volume in the Fiona Fleming Cozy Mysteries! Find books one through five available    Bed and Breakfast and Murder   Chocolate Hearts and Murder   Fame and Fortune and Murder   Ghosts and Goblins and Murder   Ganache and Fondant and Murder   Ropes and Trees and Murder   Anchors Away and Murder","eng","LMisterioThriller","eng","","","","Misterio·Thriller·Terror","95","Elecciones locales y asesinato en un retiro de caza, Fee investiga.","Fiona Fleming Cozy Mysteries","1.0"
"Runways and High Heels and Murder","Patti Larsen","Genero · Fantasia, Paranormal · Brujas/Magos, Tono · Cozy/Ligero","Fiona Fleming Cozy Mysteries","9.0","An empowering kind of moment I had no idea hitting someone could be so emotionally satisfying. Not that I condoned violence on a regular basis, but I did happen to be known for my temper. Still, I usually took the pacifist route on the outside, if I tended to boil over on the inside. This opportunity to actually use my fists to strike out at another human being had much more appeal than I should have allowed myself. And the tight grin and panting half-hiccup, half giggle that escaped me every time I punched Matt honestly had to go. Self-defense class was fun, yo. Fee and Crew have fallen into a delightful romance while Reading’s continuing popularity keeps her busy at work. When a fashion show comes to town, Fee finds herself hosting Vivian French’s favorite designer at Petunia’s, along with the drama that entails. But when one of the elite ends up dead, it’s the drama between her loved ones that gets Fee the most riled up while she does her best to solve yet another murder. Don't miss a single volume in the Fiona Fleming Cozy Mysteries! Find books one through five available Bed and Breakfast and Murder Chocolate Hearts and Murder Fame and Fortune and Murder Ghosts and Goblins and Murder Ganache and Fondant and Murder Ropes and Trees and Murder Anchors Away and Murder Guns and Ammo and Murder","eng","LMisterioThriller","eng","","","","Misterio·Thriller·Terror","95","Pasarela de moda y asesinato, serie cozy.","Fiona Fleming Cozy Mysteries","1.0"
"Plaid and Fore! And Murder","Patti Larsen","Genero · Fantasia, Paranormal · Brujas/Magos, Tono · Cozy/Ligero","Fiona Fleming Cozy Mysteries","10.0","A mulligan kind of instant “Sorry about the whole clandestine next state over photo adventure,” Crew said. “It’s not like anyone else is looking since those treasure hunters debunked the idea.” I remembered Olivia’s disappointment, how she’d invested so much time and effort into the Captain Reading branding. If only she knew… Daisy made a noise, a choking, nervous sound that made me sigh. “Day,” I said, voice low and doing my best not to feel disappointed despite knowing what she was about to say. “It’s okay. Just tell us.” She met my eyes, her gray ones huge, while Crew waited, photos limp in his hands but zero judgment on his face, either. “I’m sorry,” she whispered, head hanging now. “It’s not just us. I told Rose everything.” When a golf pro falls victim to murder during a tournament hosted at the White Valley Golf and Country Club, Fee finds herself embroiled in the mystery while the hunt for the Reading hoard heats up and secrets behind the disappearance of Fiona Doyle are finally revealed. Don't miss a single volume in the Fiona Fleming Cozy Mysteries! Find books one through five available Bed and Breakfast and Murder Chocolate Hearts and Murder Fame and Fortune and Murder Ghosts and Goblins and Murder Ganache and Fondant and Murder Ropes and Trees and Murder Anchors Away and Murder Guns and Ammo and Murder High Heels and Runways and Murder","eng","LMisterioThriller","eng","","","","Misterio·Thriller·Terror","95","Asesinato en torneo de golf, misma serie.","Fiona Fleming Cozy Mysteries","1.0"
"Whips and Spurs and Murder","Patti Larsen","Genero · Fantasia, Paranormal · Brujas/Magos, Tono · Cozy/Ligero","Fiona Fleming Cozy Mysteries","11.0","An epic kind of year There were times when I made truly bad choices in life, moments when I knew better but I just couldn’t seem to help myself. You know what I mean, right? How logic and common sense seem to diverge with the powerful urge to act despite the innate understanding such actions will likely get you into a world of trouble and may not, in the end, be worth it? And, despite knowing all that, no matter how much you work to convince yourself some things are better left undone, let go, abandoned you just can’t seem to allow yourself the freedom to be a good, normal person and simply mind your own business. Wait. Was that just me? Sigh. Yeah. Just me. Okay then. Fiona Fleming’s plans to sneak into the exclusive Patterson wedding are interrupted when she stumbles on yet another body. With Crew out of town and the sheriff’s department short staffed, Fee finds herself investigating alongside his former FBI partner, Elizabeth Michaud. While she does her best to solve the murder, she uncovers further mysteries around the ruling family of the cutest town in America. Don't miss a single volume in the Fiona Fleming Cozy Mysteries! Find books one through ten available Bed and Breakfast and Murder Chocolate Hearts and Murder Fame and Fortune and Murder Ghosts and Goblins and Murder Ganache and Fondant and Murder Ropes and Trees and Murder Anchors Away and Murder Guns and Ammo and Murder High Heels and Runways and Murder Plaid and Fore! and Murder","eng","LMisterioThriller","eng","","","","Misterio·Thriller·Terror","95","Boda exclusiva y asesinato, tono cozy.","Fiona Fleming Cozy Mysteries","1.0"
"Something Borrowed, Something Blue and Murder","Patti Larsen","Genero · Fantasia, Paranormal · Brujas/Magos, Tono · Cozy/Ligero","Fiona Fleming Cozy Mysteries","12.0","**An old kind of new** Crew closed the distance between us, my head suddenly tucked under his chin, hands pressing me to him, rocking me gently, softly while he whispered my name in my ear. “Fee, I love you. I stayed for you, from the first time we met. I knew it was you.”Damn it, Crew Turner. Stop that right now. He turned me slightly, still holding me, and went on. “For better or worse, this place is home, now.” He nodded to Vivian who nodded back. “No matter what happens, I guess I’m about to become a Fleming.” I laughed at that through my tears, while Dad chuckled and Mom tsked. But, knowing Reading? That was exactly what everyone would think.Poor Crew.With a fresh death in none other than her beloved Petunia’s, and her wedding hanging in the balance, Fee must accept a role she never expected while doing her best to catch a murderer, all while realizing there’s a very good chance someone has it out for her…","eng","LMisterioThriller","eng","","","","Misterio·Thriller·Terror","95","Boda y asesinato en Petunia's, tono cozy.","Fiona Fleming Cozy Mysteries","1.0"
"Pirate Gold and Murder","Patti Larsen","Genero · Fantasia, Paranormal · Brujas/Magos, Tono · Cozy/Ligero","Fiona Fleming Cozy Mysteries","13.0","** *A swashbuckling kind of life* **  *I could honestly say there was nothing more incredible than opening my eyes to find a pair of gorgeous blue ones staring right back at me. I'd been enjoying this particular view for the last six months, with many, many more mornings to come. The rest of our lives together, to be exact, minus a few the delicious man I'd married was out of town.  How lucky could I possibly get?*  Happily married and ready for the truth, Fee and Crew go on an official search to find out if Reading's hoard actually exists. But treasure hunting takes a nasty turn when one of the dive team searching for gold goes belly up. To make matters worse, a second death adds to Fee's body count, leaving her juggling two murders and more mysteries than even a Fleming knows what to do with.  In this final installment of the **Fiona Fleming Cozy Mysteries** , will Fee finally uncover the secret of her namesake, Blackstone Corporation, Captain Reading's lost treasure and more?  Don't miss a single volume in the **Fiona Fleming Cozy Mysteries**! Find books one through twelve available now:  ** *Bed and Breakfast and Murder   Chocolate Hearts and Murder   Fame and Fortune and Murder   Ghosts and Goblins and Murder   Ganache and Fondant and Murder   Ropes and Trees and Murder   Anchors Away and Murder   Guns and Ammo and Murder   High Heels and Runways and Murder   Plaid and Fore! and Murder   Whips and Spurs and Murder   Something Borrowed, Something Blue, and Murder* **","eng","LMisterioThriller","eng","","","","Misterio·Thriller·Terror","95","Búsqueda de tesoro con asesinatos, serie cozy.","Fiona Fleming Cozy Mysteries","1.0"
"Deck the Halls and Murder","Patti Larsen","Genero · Fantasia, Paranormal · Brujas/Magos, Tono · Cozy/Ligero","Fiona Fleming Cozy Mysteries","14.0","A cozy kind of Christmas  The annual Christmas parade and tree lighting is interrupted when a corpse—rather than Santa—takes center stage. With her father’s investigation into the original crime under question, Fee pursues the truth while trying to hang onto her holiday spirit without spoiling her chances at a date with Sheriff Crew Turner.  PLEASE NOTE (possible spoiler alert): Deck The Halls and Murder takes place AFTER Fiona Fleming Cozy Mysteries #4 (Ghosts and Goblins and Murder). Reading to that point prior to this volume is strongly recommended.","eng","LMisterioThriller","eng","","","","Misterio·Thriller·Terror","95","Misterio durante desfile navideño con un cadáver.","Fiona Fleming Cozy Mysteries","1.0"
"Haute Couture and Death","Patti Larsen","Genero · Fantasia, Paranormal · Brujas/Magos, Tono · Cozy/Ligero","Fleming Investigations Cozy Mysteries","9.0","**Fancy dresses, ancient history and murder!**  
  
Fiona Fleming's return to the Big Apple has her helping out an old friend while reliving the past. But Vivian French's troubles turn from a bit of sleuthing to something much more deadly when the Queen of Wheat's foray into the world of high fashion design ends in death. Can Fee put aside her memories in time to save Vivian from losing her dream? Or worse, get sent to prison for murder?  
  
Available now from **Fleming Investigations Cozy Mysteries:  
Patent Pending and Death  
Inquiring Minds and Death  
Finding Zen and Death  
All In and Death  
Out With the Old and Death  
Tropical Destinations and Death  
Family Enterprise and Death**
","eng","LMisterioThriller","eng","","","","Misterio·Thriller·Terror","95","Cozy mystery con investigadora principal, sin romance central.","Fleming Investigations Cozy Mysteries","1.0"
"Patent Pending and Death","Patti Larsen","Genero · Fantasia, Paranormal · Brujas/Magos, Tono · Cozy/Ligero","Fleming Investigations Cozy Mysteries","1.0","Fiona Fleming is back, and, just her luck, the bodies keep piling up! Happily married and diving into her new career, Fee finds herself once again embroiled in the heart of mysteries she can’t seem to stop solving. At least this time she’s actually legit. Acting as local investigator for her co-owned Fleming Investigations private eye firm while her father, John, takes care of things more far flung, Fee not only uncovers the wrongdoings she's been hired to solve, but stumbles yet again over death, mayhem and murderers bent on keeping their secrets to themselves.  Welcome back to Reading, Vermont, the cutest (and deadliest!) town in America!","eng","LMisterioThriller","eng","","","","Misterio·Thriller·Terror","95","Retorno a Reading, casos de asesinato.","Fleming Investigations Cozy Mysteries","1.0"
"Finding Zen and Death","Patti Larsen","Genero · Fantasia, Paranormal · Brujas/Magos, Tono · Cozy/Ligero","Fleming Investigations Cozy Mysteries","3.0","The women’s retreat weekend was supposed to relax Fee, not lead to murder! When an unwelcome guest goes belly up, and Mother Nature interferes in a cry for the cavalry, Fee is on the case, doing her best to find the killer before she becomes the next victim.","eng","LMisterioThriller","eng","","","","Misterio·Thriller·Terror","95","Retiro de mujeres que termina en asesinato, Fee investiga.","Fiona Fleming Cozy Mysteries","1.0"
"All in and Death","Patti Larsen","Genero · Fantasia, Paranormal · Brujas/Magos, Tono · Cozy/Ligero","Fleming Investigations Cozy Mysteries","4.0","When Fee is hired as extra security for a poker tournament, she fully expects to learn a thing or two. Trouble is, when one of the players dies during play, she not only has to use her specialized skills to figure out who killed him, she’s forced to do so under threat of arrest courtesy of her hated cousin, Sheriff Robert Carlisle. Will the right person end up behind bars or will Fee go to jail for trying find a killer?","eng","LMisterioThriller","eng","","","","Misterio·Thriller·Terror","95","Misterio cozy con protagonista que investiga la muerte de un jugador de póker.","Fiona Fleming Cozy Mysteries","1.0"
"Out With the Old and Death","Patti Larsen","Genero · Fantasia, Paranormal · Brujas/Magos, Tono · Cozy/Ligero","Fleming Investigations Cozy Mysteries","5.0","When Fee and Crew are invited to a New Year’s Eve soiree at Emile and Daisy’s amazing penthouse, the last thing she wants is to get dolled up and pretend to have a good time when she would prefer to stay home and spend the evening with her husband. Trouble is as trouble does, naturally, so her plans to retreat after an hour are thwarted when one of the guests—a popular social media influencer—turns up dead and it’s up to her to solve the mystery before the clock turns to midnight.","eng","LMisterioThriller","eng","","","","Misterio·Thriller·Terror","95","Misterio en fiesta de Año Nuevo, cozy.","Fleming Investigations Cozy Mysteries","1.0"
"Tropical Destinations and Death","Patti Larsen","Genero · Fantasia, Paranormal · Brujas/Magos, Tono · Cozy/Ligero","Fleming Investigations Cozy Mysteries","6.0","When Fee and Daisy take a well-earned vacation on a private resort island, the intrusion of a third wheel distracts while Fee struggles to reconnect with her bestie. Trouble is, when a fellow guest turns up dead, she’s torn between work and pleasure that could possibly spell the end of her life-long friendship and, if she doesn’t get her act together, mean both she and Daisy won’t get a chance to reconcile because they’ll both be dead…","eng","LMisterioThriller","eng","","","","Misterio·Thriller·Terror","95","Vacaciones en isla con asesinato, misma serie.","Fleming Investigations Cozy Mysteries","1.0"
"Inquiring Minds and Death","Patti Larsen","Cozy Mystery, Genero · Fantasia, Paranormal · Brujas/Magos, Tono · Cozy/Ligero","Fleming Investigations","2.0","Now a fully licensed PI and working her own cases, Fee’s professional future comes into question once again with the discovery of an opponent’s body. She quickly uncovers ties to old crimes that could mean motive for murder, though her sympathies for the prime suspect could interfere with her ability to solve the crime…
","eng","LMisterioThriller","eng","","","","Misterio·Thriller·Terror","95","Continuación de la misma serie cozy mystery.","Fleming Investigations Cozy Mysteries","1.0"
"Family Enterprise and Death","Patti Larsen","Genero · Fantasia, Paranormal · Brujas/Magos, Tono · Cozy/Ligero","Fleming Investigations Cozy Mysteries","7.0","***The Cutest (Criminal) Town in America…?** *  Fiona Fleming expected green beer and Irish music for St. Patrick’s Day, not the murder of a local organized crime stoolie whose death puts her little town back into the crosshairs. But was he killed because of the O’Shea crime family or was his cause of death more personal—and therefore closer to home? With a Virginia State Police’s BCI detective breathing down her neck, Fee puts her investigative skills to the test against the Reading sheriff’s department, the head of the O’Shea crime family and her own father in order to find the truth.  **Available now from Fleming Investigations Cozy**   ***Patent Pending and Death   Inquiring Minds and Death   Finding Zen and Death   All In and Death   Out With the Old and Death   Tropical Destinations and Death** *","eng","LMisterioThriller","eng","","","","Misterio·Thriller·Terror","95","Muerte de un soplón de la mafia local, investigación de crimen organizado.","Fiona Fleming Cozy Mysteries","1.0"
