title,authors,tags,series,series_index,comments,languages,library_name,#world,#subjects,#clasificacion,#info,#libreria,#confianza_ia,#motivo_ia,#serie_ia,#serie_ia_index
"Paradox","Alex Archer","Arquetipo · Heroe reticente, Arquetipo · Mentor sabio, Dinamica · Grupo variopinto/Ragtag, Dinamica · Pez fuera del agua, Paranormal · Magia, Subgenero · Aventura/Quest","Rogue Angel","21.0","<br><br>Archaeologist Annja Creed reluctantly accepts an assignment on behalf of a covert arm of the U.S. Government. She is to lead an expedition to the top of Mount Ararat to find the truth about what is thought to be the remains of Noah's Ark. But while she doubts the massive anomaly is really the Ark, she can't help but wonder what is up there. Annja must escort a group of militant fundamentalists through civil unrest in eastern Turkey, but the impending war is nothing compared to the danger that lies hidden within the team. With lives at stake, Annja has no choice but to protect the innocent...and get them out of there alive. Legend says the Ark once saved mankind, but this time it could kill them all.  Archaeologist Annja Creed reluctantly accepts an assignment on behalf of a covert arm of the U.S. Government. She is to lead an expedition to the top of Mount Ararat to find the truth about what is thought to be the remains of Noah's Ark. But while she doubts the massive anomaly is really the Ark, she can't help but wonder what is up there. Annja must escort a group of militant fundamentalists through civil unrest in eastern Turkey, but the impending war is nothing compared to the danger that lies hidden within the team. With lives at stake, Annja has no choice but to protect the innocent...and get them out of there alive. Legend says the Ark once saved mankind, but this time it could kill them all. SUMMARY: Archaeologist Annja Creed reluctantly accepts an assignment on behalf of a covert arm of the U.S. Government. She is to lead an expedition to the top of Mount Ararat to find the truth about what is thought to be the remains of Noah’s Ark. But while she doubts the massive anomaly is really the Ark, she can’t help but wonder what is up there. Annja must escort a group of militant fundamentalists through civil unrest in eastern Turkey, but the impending war is nothing compared to the danger that lies hidden within the team. With lives at stake, Annja has no choice but to protect the innocent…and get them out of there alive. Legend says the Ark once saved mankind, but this time it could kill them all.  <p>Archaeologist Annja Creed reluctantly accepts an assignment on behalf of a covert arm of the U.S. Government. She is to lead an expedition to the top of Mount Ararat to find the truth about what is thought to be the remains of Noah's Ark. But while she doubts the massive anomaly is really the Ark, she can't help but wonder what is up there. Annja must escort a group of militant fundamentalists through civil unrest in eastern Turkey, but the impending war is nothing compared to the danger that lies hidden within the team. With lives at stake, Annja has no choice but to protect the innocent...and get them out of there alive. Legend says the Ark once saved mankind, but this time it could kill them all.</p>  <p class=""description"">Archaeologist Annja Creed reluctantly accepts an assignment on behalf of a covert arm of the U.S. Government. She is to lead an expedition to the top of Mount Ararat to find the truth about what is thought to be the remains of Noah's Ark. But while she doubts the massive anomaly is really the Ark, she can't help but wonder what is up there. Annja must escort a group of militant fundamentalists through civil unrest in eastern Turkey, but the impending war is nothing compared to the danger that lies hidden within the team. With lives at stake, Annja has no choice but to protect the innocent...and get them out of there alive. Legend says the Ark once saved mankind, but this time it could kill them all.<br>SUMMARY:<br>Archaeologist Annja Creed reluctantly accepts an assignment on behalf of a covert arm of the U.S. Government. She is to lead an expedition to the top of Mount Ararat to find the truth about what is thought to be the remains of Noah’s Ark. But while she doubts the massive anomaly is really the Ark, she can’t help but wonder what is up there. Annja must escort a group of militant fundamentalists through civil unrest in eastern Turkey, but the impending war is nothing compared to the danger that lies hidden within the team. With lives at stake, Annja has no choice but to protect the innocent…and get them out of there alive. Legend says the Ark once saved mankind, but this time it could kill them all.</p>","eng","LFiccion","","","Tono · Picante/Erotico, Ambientacion · Piratas, Paranormal · Brujas/Magos, Paranormal · Dragones, Paranormal · Fae/Feerico, Subgenero · Espionaje/Espias, Paranormal · Vampiros","","Misterio·Thriller·Terror","90","Expedición al Arca de Noé con conflictos y peligros, thriller de aventuras.","Rogue Angel","1.0"
"The Spirit Banner","Alex Archer","Arquetipo · Heroe reticente, Arquetipo · Mentor sabio, Dinamica · Grupo variopinto/Ragtag, Dinamica · Pez fuera del agua, Paranormal · Magia, Subgenero · Aventura/Quest","Rogue Angel","22.0","Genghis Khan carved out a legacy of bloodshed and conquered kingdoms that has lasted almost eight hundred years. But while his name and deeds live on in the annals of history, his tomb has never been located… until now.  Not everyone is convinced that the diary and the map, said to lead to the great warrior's final resting place, are authentic. Archaeologist Annja Creed is among these doubters. The reality is that the body was lost to history. But despite her skepticism, Annja suddenly finds herself pulled along an increasingly complex trail of clues, each more remote than the last.  And as she and her companions race to their final destination, one thing is clear—the only tomb she may find is her own ….","eng","LFiccion","","","Subgenero · Fantasia urbana, Tono · Oscuro","","Paranormal","90","Búsqueda de la tumba de Genghis Khan; aunque no se explicita lo sobrenatural, pertenece a la serie paranormal.","Rogue Angel","1.0"
"Sacred Ground","Alex Archer","Arquetipo · Heroe reticente, Arquetipo · Mentor sabio, Dinamica · Grupo variopinto/Ragtag, Dinamica · Pez fuera del agua, Paranormal · Magia, Subgenero · Aventura/Quest","Rogue Angel","23.0","In a land of subzero temperatures and snow-covered vistas, survival is a challenge. But for the Araktak—an isolated and mysterious Inuit people—this harsh tundra is their heritage. Until now. A large mining company has purchased the land, and the sacred Araktak burial site with it. But more than diamond deposits await them under the dark, icy earth….  Contracted by the mining company, archaeologist Annja Creed is to oversee the proper relocation of the burial site. Her job is to ensure that each ancient relic and all human remains are carefully removed. But the sacred ground harbors a terrible secret. One that a powerful group of men intend to unleash on an unsuspecting world—unless Annja can find a way to stop them.","eng","LFiccion","","","Tono · Picante/Erotico, Ambientacion · Piratas, Paranormal · Brujas/Magos, Paranormal · Dragones, Paranormal · Fae/Feerico, Subgenero · Espionaje/Espias, Paranormal · Vampiros","","Misterio·Thriller·Terror","90","Cementerio inuit y complot corporativo, thriller arqueológico.","Rogue Angel","1.0"
"The Bone Conjurer","Alex Archer","Arquetipo · Heroe reticente, Arquetipo · Mentor sabio, Dinamica · Grupo variopinto/Ragtag, Dinamica · Pez fuera del agua, Paranormal · Magia, Subgenero · Aventura/Quest","Rogue Angel","24.0","From the ashes of an ancient holy order comes an unholy relic…In the time of the Crusades, the Knights Templars were holy warriors who seemed to be blessed by God himself. But over the years, the order dissolved into mysteries both sacred and profane—creating an object whose power bends to the true nature of its owner….But until she held it in her hands, archaeologist Annja Creed hadn't heard of the Skull of Sidon nor the twisted tale of its origins. Even now, she's still not convinced. Yet someone wants it badly enough to hire a man who wields power beyond her imagining. Power enough to prevent Annja from protecting the mysterious skull. And power enough to kill.","eng","LFiccion","","","Subgenero · Fantasia urbana","","Fantasía","90","Búsqueda de una reliquia mística (Cráneo de Sidón) con poder sobrenatural; trama de aventura con magia.","Rogue Angel","1.0"
"Tribal Ways","Alex Archer","Arquetipo · Heroe reticente, Arquetipo · Mentor sabio, Dinamica · Grupo variopinto/Ragtag, Dinamica · Pez fuera del agua, Paranormal · Magia, Subgenero · Aventura/Quest","Rogue Angel","25.0","A frigid spring morning at a Native American archaeological dig erupts into sudden and brutal violence, leaving five people dead and one man gravely wounded. And in a hospital, with archaeologist Annja Creed at his side, the last survivor utters his final words to name his killer—a skinwalker.The skinwalker is feared among the Navajo and Apache. It is witchcraft of a most terrible nature that allows a man to take the shape of a wolf—and kill. But as Annja delves into the mystery of the skinwalker, she finds herself pulled into an underworld of violence and vicious radicals, threaded with legend…and sociopathic intent.In this world, Annja is unwelcome. And in this world, she could be the creature's next victim….","eng","LFiccion","","","Paranormal · Lobos/Shifters, Subgenero · Fantasia urbana, Tono · Oscuro","","Paranormal","90","Skinwalker (cambiaformas) que mata; brujería navajo y violencia sobrenatural.","Rogue Angel","1.0"
"The Dragon's Mark","Alex Archer","Arquetipo · Heroe reticente, Arquetipo · Mentor sabio, Dinamica · Grupo variopinto/Ragtag, Dinamica · Pez fuera del agua, Paranormal · Magia, Subgenero · Aventura/Quest","Rogue Angel","26.0","Archaeologist Annja Creed and her sword have never been outmatched— until now. When a surprise party for her mentor Roux includes some uninvited guests, Annja finds herself fighting desperately for her life. The intruders escape but leave a sinister message behind.  A legend has resurfaced about a sword that should be feared. A sword that seeks a master as bloodthirsty as itself. It is wielded by an assassin known as the Dragon who initiates a terrible game of cat and mouse. Eventually, the two swords—light and dark—must meet…and only one shall triumph.","eng","LFiccion","","","Subgenero · Fantasia urbana, Tono · Oscuro","","Fantasía","90","Dos espadas mágicas (luz y oscuridad) se enfrentan; asesino llamado Dragón; fantasía urbana con conflicto sobrenatural.","Rogue Angel","1.0"
"Phantom Prospect","Alex Archer","Arquetipo · Heroe reticente, Arquetipo · Mentor sabio, Dinamica · Grupo variopinto/Ragtag, Dinamica · Pez fuera del agua, Paranormal · Magia, Subgenero · Aventura/Quest","Rogue Angel","27.0","**A ship lost at sea lures divers with her siren call** Intrepid treasure hunters believe they have discovered the final resting place of Fantome, a legendary warship that wrecked off Nova Scotia almost two hundred years ago. She was rumored to have gone down with an extraordinary treasure. But circling beneath the ocean's surface waits something unbelievable… and terrifying. Some unfortunate divers have encountered a massive, thought-to-be-extinct shark known as the megalodon.  Archaeologist Annja Creed has always had a healthy respect for sharks. But when a researcher friend asks for her help, Annja braves the deep, cold waters of the Atlantic, determined to discover the truth. Instead she finds herself hunting an unknown traitor on a sabotaged ship. With death waiting both above and below the ocean's surface, Annja must battle her most dangerous enemy yet.","eng","LFiccion","","","Tono · Picante/Erotico, Ambientacion · Piratas, Paranormal · Brujas/Magos, Paranormal · Dragones, Paranormal · Fae/Feerico, Subgenero · Espionaje/Espias, Paranormal · Vampiros","","Misterio·Thriller·Terror","90","Tesoro submarino y tiburón prehistórico, misterio y acción acuática.","Rogue Angel","1.0"
"Restless Soul","Alex Archer","Arquetipo · Heroe reticente, Arquetipo · Mentor sabio, Dinamica · Grupo variopinto/Ragtag, Dinamica · Pez fuera del agua, Paranormal · Magia, Subgenero · Aventura/Quest","Rogue Angel","28.0","In 1966, a group of battle-weary American GIs trekked through the Vietnamese jungle knowing each step could mean facing the enemy's guns. But instead of ambush, they stumbled upon a hidden treasure beyond their wildest dreams. It was a discovery that exacted a terrible cost.  A vacation spot picked at random, Thailand is intended to provide relaxation time for globe-trotting archaeologist Annja Creed. Yet the irresistible pull of the country's legendary Spirit Cave lures Annja and her companions deep within a network of underground chambers—nearly to their deaths. The ancient burial sites have slumbered through the ages. Yet no rest is found there—just the voices of the dead. When the dead speak, will they help Annja uncover the perplexing past of a remarkable find or will they call her to join them?","eng","LFiccion","","","Tono · Picante/Erotico, Ambientacion · Piratas, Paranormal · Brujas/Magos, Paranormal · Dragones, Paranormal · Fae/Feerico, Subgenero · Espionaje/Espias, Paranormal · Vampiros","","Misterio·Thriller·Terror","90","Tesoro de guerra en Vietnam y espíritus, misterio en cuevas tailandesas.","Rogue Angel","1.0"
"False Horizon","Alex Archer","Arquetipo · Heroe reticente, Arquetipo · Mentor sabio, Dinamica · Grupo variopinto/Ragtag, Dinamica · Pez fuera del agua, Paranormal · Magia, Subgenero · Aventura/Quest","Rogue Angel","29.0","<br><br>A small Nepali man melts into shadows. A cutthroat crime lord is looking for a miraculous cure. And a map to an impossible dream and a mythic paradise is pointing the way.<br><br>Archaeologist Annja Creed is in Katmandu, awash in its scents, sounds and liveliness. But this is no sightseeing trip. An old friend is in possession of a map that leads to a place that lies outside our world. But the map is known to one other--a vicious man who has Annja and her companions right where he wants them. Her hand forced, Annja sets out in search of the fabled Shangri-La--an expedition of danger and subversion.<br><br>And her journey will end only with triumph...or tragedy.  <p class=""description"">SUMMARY:<br>A small Nepali man melts into shadows. A cutthroat crime lord is looking for a miraculous cure. And a map to an impossible dream and a mythic paradise is pointing the way.Archaeologist Annja Creed is in Katmandu, awash in its scents, sounds and liveliness. But this is no sightseeing trip. An old friend is in possession of a map that leads to a place that lies outside our world. But the map is known to one other—a vicious man who has Annja and her companions right where he wants them. Her hand forced, Annja sets out in search of the fabled Shangri-La—an expedition of danger and subversion.And her journey will end only with triumph…or tragedy.</p>  <p>A small Nepali man melts into shadows. A cutthroat crime lord is looking for a miraculous cure. And a map to an impossible dream and a mythic paradise is pointing the way.Archaeologist Annja Creed is in Katmandu, awash in its scents, sounds and liveliness. But this is no sightseeing trip. An old friend is in possession of a map that leads to a place that lies outside our world. But the map is known to one other--a vicious man who has Annja and her companions right where he wants them. Her hand forced, Annja sets out in search of the fabled Shangri-La--an expedition of danger and subversion.<br /></p><p>And her journey will end only with triumph...or tragedy.</p>","eng","LFiccion","","","Subgenero · Fantasia urbana","","Fantasía","90","Búsqueda de Shangri-La, un lugar mítico; mapa y artefactos; espada mágica; aventura fantástica.","Rogue Angel","1.0"
"The Other Crowd","Alex Archer","Arquetipo · Heroe reticente, Arquetipo · Mentor sabio, Dinamica · Grupo variopinto/Ragtag, Dinamica · Pez fuera del agua, Paranormal · Magia, Subgenero · Aventura/Quest","Rogue Angel","30.0","In a remote part of Ireland, two archaeological teams dig for the find of a lifetime—the legendary Spear of Lugh. Folklore claims the magical weapon was forged in the time of the ancient Tuatha de Danaan. But as the search intensifies, people begin disappearing from the dig. ""Faeries,"" whisper the locals. The Other Crowd…  Instructed to travel to Ireland and return with faerie footage, archaeologist Annja Creed figures it's a joke assignment. But people have vanished and she soon realizes there's more in play than mythical wee folk. With the unsettling notion that something otherworldly is in the air, Annja is torn between her roles as an archaeologist and a warrior. But can her powerful sword protect her from the threat of violence…or the Other Crowd?","eng","LFiccion","","","Tono · Picante/Erotico, Ambientacion · Piratas, Paranormal · Brujas/Magos, Paranormal · Dragones, Paranormal · Fae/Feerico, Subgenero · Espionaje/Espias, Paranormal · Vampiros","","Misterio·Thriller·Terror","90","Desapariciones y leyenda de hadas en Irlanda, misterio con toque sobrenatural.","Rogue Angel","1.0"
"Tear of the Gods","Alex Archer","Arquetipo · Heroe reticente, Arquetipo · Mentor sabio, Dinamica · Grupo variopinto/Ragtag, Dinamica · Pez fuera del agua, Paranormal · Magia, Subgenero · Aventura/Quest","Rogue Angel","31.0","The legacy of a pagan king could unleash terror on the world  It started as a dream—a redheaded warrior king fought and died for his men centuries ago. The dream would lead archaeologist Annja Creed to the king's undisturbed corpse...and one of England's greatest mythical artifacts.  Deep in an archaeological dig in England's Midlands, Annja locates a braided necklace around a mummified king's neck. Made of an unusual material—not quite obsidian, but gleaming with multihued color—the torc is an astonishing find. But someone knows exactly what the torc means. And he will do anything to get his hands on the Tear of the Gods. When the dig is compromised and innocent archaeologists are slain, even Annja herself is left for dead. Now she is fleeing for her life, not knowing the terrifying truth about the relic she risks everything to protect—or the devastating consequences should it fall into the wrong hands....","eng","LFiccion","","","Subgenero · Fantasia urbana, Tono · Oscuro, Paranormal · Angeles y demonios","","Paranormal","90","Artefacto mítico (Lágrima de los Dioses) que puede desatar terror; elemento sobrenatural central.","Rogue Angel","1.0"
"The Oracle's Message","Alex Archer","Arquetipo · Heroe reticente, Arquetipo · Mentor sabio, Dinamica · Grupo variopinto/Ragtag, Dinamica · Pez fuera del agua, Paranormal · Magia, Subgenero · Aventura/Quest","Rogue Angel","32.0","Men would do anything for it…but one woman will determine its fate  Steeped in legend, the Pearl of Palawan has a history marked by destruction, vengeance and love. But more important, the mythical black pearl is rumored to grant a power long coveted by mankind—immortality. It is a power men would risk dying to achieve.  Sun, sand and scuba diving in the Philippines certainly sounded like an ideal vacation. But after a way-too-close-for-comfort encounter with a tiger shark, archaeologist Annja Creed finds herself drawn into a group of German divers. They are treasure hunters searching for the fabled pearl. Out of curiosity, Annja accompanies them. But when an old friend of hers turns up unexpectedly, she finds herself torn between her past and new acquaintances.  The race is on to possess the pearl. But no one realizes the true nature of the artifact, or the danger it poses to them all.","eng","LFiccion","","","Subgenero · Fantasia urbana, Tono · Oscuro","","Paranormal","90","Perla negra legendaria que otorga inmortalidad; búsqueda submarina con elementos míticos.","Rogue Angel","1.0"
"Cradle of Solitude","Alex Archer","Arquetipo · Heroe reticente, Arquetipo · Mentor sabio, Dinamica · Grupo variopinto/Ragtag, Dinamica · Pez fuera del agua, Paranormal · Magia, Subgenero · Aventura/Quest","Rogue Angel","33.0","One mystery could change the fate of a nation…The skeletal remains of a confederate soldier, hidden deep within the Paris Catacombs. The legend of a long-lost Confederate treasure. An aged scrap of paper that reads simply, Berceau de solitude—Cradle of Solitude.
It was sheer dumb luck, really. Archaeologist Annja Creed happened to be in Paris when the bones of the soldier were discovered. But this was no ordinary soldier—this man was the keeper of a treasure that could have affected the outcome of the American Revolution. Somewhere, the treasure waits to be claimed.
Now Annja is unraveling a 150-year-old mystery and a trail of clues that will lead her across the ocean and deep into the heart of the Old South. But she isn’t the only seeker of this treasure. Someone else wants it—bad enough to kill anyone who stands in their way….
","eng","LFiccion","","","Subgenero · Fantasia urbana","","Fantasía","90","Búsqueda de un tesoro confederado con pistas esotéricas; espada mágica y huesos antiguos; fantasía arqueológica.","Rogue Angel","1.0"
"Labyrinth","Alex Archer","Arquetipo · Heroe reticente, Arquetipo · Mentor sabio, Dinamica · Grupo variopinto/Ragtag, Dinamica · Pez fuera del agua, Paranormal · Magia, Subgenero · Aventura/Quest","Rogue Angel","34.0","A book dealer lies imprisoned in a Boston mansion, an IV tube dripping a lethal narcotic cocktail into his veins. In thirty-six hours, he'll be dead. His final request is to receive a visit from one woman.... It wasn't the most hospitable invitation she'd ever received. Archaeologist Annja Creed is being rushed to Massachussetts, abducted by a famous environmental terrorist—a zealot willing to kill anyone who gets in his or the planet's way. He has taken the book dealer hostage in order to steal a rare and very valuable treatise called the Tome of Prossos. Annja is the key to retrieving the ancient manuscript hidden somewhere deep within the mansion. But the book is well-protected. In order to find it, she must survive the rigors of an elaborate maze. She has only twelve hours to decipher the labyrinth's sinister secret...a secret that could ensure she never emerges.","eng","LFiccion","","","Tono · Picante/Erotico, Ambientacion · Piratas, Paranormal · Brujas/Magos, Paranormal · Dragones, Paranormal · Fae/Feerico, Subgenero · Espionaje/Espias, Paranormal · Vampiros","","Misterio·Thriller·Terror","90","Secuestro y laberinto mortal para obtener un manuscrito, thriller puro.","Rogue Angel","1.0"
"Fury's Goddess","Alex Archer","Arquetipo · Heroe reticente, Arquetipo · Mentor sabio, Dinamica · Grupo variopinto/Ragtag, Dinamica · Pez fuera del agua, Paranormal · Magia, Subgenero · Aventura/Quest","Rogue Angel","35.0","On the outskirts of the recently developed and prosperous city of Hyderabad, India, a new and luxurious housing complex has arisen. But several residents have been found brutally murdered. Some believe the killer is a rogue tiger. Others whisper that it is the work of the servants of Kali, the Hindu goddess of death.  Her feet are barely on Indian soil when archaeologist Annja Creed finds herself swept up in Hyderabad's modern prosperity. But something about the recent spate of killings seems unusual and Annja begins to dig deep for answers. Instead, she finds herself taken prisoner and held in a maze of ancient caves. She's being held captive by a cult of thieves who are under the thrall of a charismatic leader.  In only a few short hours, Annja is to be sacrificed—unless she can channel the vengeance of the goddess Kali herself....","eng","LFiccion","","","Subgenero · Fantasia urbana, Tono · Oscuro","","Fantasía","90","Culto a Kali, sacrificios y diosa de la muerte; Annja usa su espada; fantasía con mitología hindú.","Rogue Angel","1.0"
"Magic Lantern","Alex Archer","Arquetipo · Heroe reticente, Arquetipo · Mentor sabio, Dinamica · Grupo variopinto/Ragtag, Dinamica · Pez fuera del agua, Paranormal · Magia, Subgenero · Aventura/Quest","Rogue Angel","36.0","In late 1700s Paris, a young but promising illusionist dabbles in the arcane art of phantasmagoria. But at his moment of greatest triumph—unveiling a magical lantern said to open a door to the Chinese spirit world—he is violently struck down by a vengeful phantom….  On assignment in London, archaeologist Annja Creed is hunting down a man who claims to have discovered the Jekyll and Hyde potion. On the trail of one curiosity, Annja finds herself pulled toward another mystery…the origin of a strange, old-fashioned projector once used by eighteenth-century illusionists. As Annja delves into its rich history, a dark past begins to emerge. And someone wants to harness the power of this cursed artifact…risking everything for the treasures it promises.  But Annja has a little magic trick of her own. One that she wields with deadly accuracy….","eng","LFiccion","","","Tono · Picante/Erotico, Ambientacion · Piratas, Paranormal · Brujas/Magos, Paranormal · Dragones, Paranormal · Fae/Feerico, Subgenero · Espionaje/Espias, Paranormal · Vampiros","","Misterio·Thriller·Terror","90","Artefacto maldito relacionado con ilusionistas, asesinatos y persecución.","Rogue Angel","1.0"
